,Name,Latitude,Longitude,Address,Full Address
319,Burger King,33.1373491,-117.179819,"728 W San Marcos Blvd, San Marcos","['Burger King, 728, West San Marcos Boulevard, San Marcos, San Diego County, California, 92096, United States']"
320,Burger King,33.5639842,-117.7131836,"27470 Alicia Pkwy, Laguna Niguel","['Walmart Supercenter, 27470, Alicia Parkway, Laguna Niguel, Orange County, California, 92677, United States']"
321,Burger King,33.1344831,-117.0575184,"1707 E Valley Pkwy, Escondido","['1707, East Valley Parkway, Escondido, San Diego County, California, 92027, United States']"
322,Burger King,33.177073,-117.297741,"3405 Marron Rd, Oceanside","['Walmart Supercenter, 3405, Marron Road, Quarry Creek Shopping Center, Oceanside, San Diego County, California, 92056, United States']"
323,Burger King,33.22464,-117.3329236,"3746 Mission Ave, Oceanside","['Burger King, 3746, Mission Avenue, Oceanside, San Diego County, California, 92058, United States']"
324,Burger King,33.5632171,-117.6469867,"27702 Crown Valley Pkwy Suite G, Ladera Ranch",['NaN']
325,Burger King,33.1296057,-117.0891416,"244 W Mission Ave, Escondido","['Burger King, 244, West Mission Avenue, Escondido, San Diego County, California, 92025, United States']"
326,Burger King,36.9785955,-121.9653765,"2001 41st Ave, Capitola","['Burger King, 2001, 41st Avenue, Capitola Mall, Capitola, Santa Cruz County, California, 95010, United States']"
327,Burger King,36.9808957,-122.0074541,"1302 Soquel Ave, Santa Cruz","['1302, Soquel Avenue, Soquel Avenue Commercial Corridor, Eastside, Santa Cruz, Santa Cruz County, California, 95062, United States']"
328,Burger King,36.9627872,-122.0433708,"2015 Mission St, Santa Cruz",['NaN']
329,Burger King,36.8005129,-121.6645657,"8093 San Miguel Canyon Rd, Salinas","['Burger King, 8093, San Miguel Canyon Road, C. F. Langley Subdivision, Salinas, Monterey County, California, 93907, United States']"
330,Burger King,36.6637265,-121.6570725,"909 S Main St, Salinas","['South Main Street, Salinas, Monterey County, California, 93901, United States']"
331,Burger King,36.5994772,-121.8497273,"1090 Fremont Blvd, Seaside","['1090, Fremont Boulevard, Seaside, Monterey County, California, 93955, United States']"
332,Burger King,36.9071048,-121.7528996,"142 Main St, Watsonville","['142, Main Street, Watsonville, Santa Cruz County, California, 95076, United States']"
333,Burger King,36.7218579,-121.6636355,"131 Auto Center Cir, Salinas","['131, Auto Center Circle, Salinas Auto Center, Santa Rita, Salinas, Monterey County, California, 93907, United States']"
334,Burger King,36.6706576,-121.6271657,"41 S Sanborn Rd, Salinas","['41, South Sanborn Road, Salinas, Monterey County, California, 93905, United States']"
335,Burger King,36.6958252,-121.596913,"1589 N Sanborn Rd, Salinas","['Burger King, 1589, North Sanborn Road, Salinas, Monterey County, California, 93905-4717, United States']"
336,Burger King,36.687092,-121.7996706,"200 Reservation Rd, Marina","['200, Reservation Road, Marina, Monterey County, California, 93933, United States']"
337,Burger King,36.70500990000001,-121.6535546,"1375 N Main St, Salinas","['1375, North Main Street, Salinas, Monterey County, California, 93906, United States']"
338,Burger King,36.7618475,-121.7533033,"11290 Merritt St, Castroville","['11290, Merritt Street, Castroville, Monterey County, California, 95012, United States']"
339,Burger King,36.837713,-121.3903105,"1720 Airline Hwy, Hollister","['Airline Highway, Hollister, San Benito County, California, 95023-7612, United States']"
340,Burger King,36.9267919,-121.7653209,"1403 Freedom Blvd, Watsonville","['1403, Freedom Boulevard, Watsonville, Santa Cruz County, California, 95076, United States']"
341,Burger King,33.6999837,-116.19309,"48079 Grapefruit Blvd, Coachella","['Grapefruit Boulevard, Coachella, Riverside County, California, United States']"
342,Burger King,33.7115077,-116.2375049,"81-779 CA-111, Indio","['111, Indio Drive, Baden, South San Francisco, San Mateo County, California, 94080, United States']"
343,Burger King,33.7727571,-116.958323,"1503 S San Jacinto Ave, San Jacinto","['San Jacinto Avenue, San Jacinto, Riverside County, California, 92583, United States']"
344,Burger King,33.7593055,-116.2970477,"78405 Varner Rd, Palm Desert","['KHCS-FM (Palm Desert), Varner Road, Thousand Palms, Cathedral City, Riverside County, California, 92263, United States']"
345,Burger King,34.1322462,-116.3845298,"58501 Twentynine Palms Highway, Yucca Valley",['NaN']
346,Burger King,33.9289521,-116.9472903,"1695 E 6th St, Beaumont","['1695, East 6th Street, Beaumont, Riverside County, California, 92223, United States']"
347,Burger King,33.7980884,-116.3848987,"Inside Walmart, 34500 Monterey Ave, Palm Desert",['NaN']
348,Burger King,34.1350723,-116.098001,"71707 Twentynine Palms Highway, Twentynine Palms","['Holiday Inn Express Hotel & Suites Twentynine Palms, 29 Palms Highway, Smoke Tree, Twentynine Palms, San Bernardino County, California, 92277, United States']"
349,Burger King,37.8079032,-121.2165678,"700 N Main St, Manteca","['700, North Main Street, Manteca, San Joaquin County, California, 95336, United States']"
350,Burger King,37.7597796,-121.4345418,"3220 N Tracy Blvd, Tracy","['Burger King, 3220, North Tracy Boulevard, Greenfield, Tracy, San Joaquin County, California, 95376, United States']"
351,Burger King,37.7536791,-121.4695624,"2890 Grant Line Rd, Tracy","['East Grant Line Road, Tracy, San Joaquin County, California, 95376, United States']"
352,Burger King,37.8251934,-121.2877294,"15119 S Harlan Rd, Lathrop","['15119, South Harlan Road, Lathrop, San Joaquin County, California, 95330, United States']"
353,Burger King,37.9374623,-121.296224,"Burger King, 619 W Charter Way, Stockton","['Burger King, West Charter Way, Stockton, San Joaquin County, California, 95202, United States']"
354,Burger King,37.9056626,-121.2213582,"4881 CA-99, Stockton","['CA 99, Stockton, San Joaquin County, California, 95213, United States']"
355,Burger King,37.9634435,-121.2732381,"702 N Wilson Way, Stockton","['702, North Wilson Way, Stockton, San Joaquin County, California, 95205, United States']"
356,Burger King,39.9272363,-122.197921,"888 West Highway 99, Corning",['NaN']
357,Burger King,39.94384429999999,-122.1969842,California 96021,"['Corning, Tehama County, California, 96021, United States']"
358,Burger King,34.0593241,-118.1724615,"1540 N Eastern Ave, Los Angeles","['1540, North Eastern Avenue, East Los Angeles, Los Angeles County, California, 90063, United States']"
359,Burger King,34.089958,-117.9250976,"1681 W San Bernardino Rd, Covina","['1681, West San Bernardino Road, West Covina, Los Angeles County, California, 91790, United States']"
360,Burger King,34.0605759,-118.2443127,"700 E Cesar E Chavez Ave, Los Angeles","['700, East Cesar E Chavez Avenue, Downtown, Los Angeles, Los Angeles County, California, 90012, United States']"
361,Burger King,36.77158379999999,-119.8644014,"4087 W Clinton Ave, Fresno","['4087, West Clinton Avenue, Fresno, Fresno County, California, 93722, United States']"
362,Burger King,36.7084216,-119.6996844,"2567 S Clovis Ave, Fresno","['2567, South Clovis Avenue, Fresno, Fresno County, California, 93727, United States']"
363,Burger King,36.8383548,-119.7536628,"7012 N Cedar Ave, Fresno","['7012, North Cedar Avenue, Fresno, Fresno County, California, 93720, United States']"
364,Burger King,36.8080196,-119.7794576,"481 E Shaw Ave, Fresno","['481, East Shaw Avenue, Fresno, Fresno County, California, 93710, United States']"
365,Burger King,36.7515272,-119.700885,"575 N Clovis Ave, Fresno","['575, North Clovis Avenue, Clovis, Fresno County, California, 93619, United States']"
366,Burger King,36.808561,-119.8546354,"3482 W Shaw Ave, Fresno","['3482, West Shaw Avenue, Fresno, Fresno County, California, 93711, United States']"
367,Burger King,36.7727514,-119.7539509,"2410 N Cedar Ave, Fresno","['2410, North Cedar Avenue, Fresno, Fresno County, California, 93703, United States']"
368,Burger King,36.8100621,-119.7140171,"1886 Villa Ave, Clovis","['1886, Villa Avenue, Clovis, Fresno County, California, 93612, United States']"
369,Burger King,37.3874723,-120.7381183,"435 Winton Pkwy, Livingston","['Travel Centers Of America, 435, Winton Parkway, Livingston, Merced County, California, 95334, United States']"
370,Burger King,36.775747,-119.790858,"2755 N Blackstone Ave, Fresno","['2755, North Blackstone Avenue, Fresno, Fresno County, California, 93703, United States']"
371,Burger King,36.735661,-119.7449067,"4610 East King's Canyon Rd, Fresno",['NaN']
372,Burger King,36.7308394,-119.8001723,"1233 Fresno St, Fresno","['1233, Fresno Street, Fresno, Fresno County, California, 93706, United States']"
373,Burger King,36.8368918,-119.6996201,"820 Herndon Ave, Clovis","['820, Herndon Avenue, Clovis, Fresno County, California, 93612, United States']"
374,Burger King,36.7353805,-120.0591731,"14890 W Whitesbridge Ave, Kerman","['14890, West Whitesbridge Avenue, Kerman, Fresno County, California, 93630, United States']"
375,Burger King,36.837523,-119.8718026,"7031 N Blythe Ave, Fresno","['7031, North Blythe Avenue, Fresno, Fresno County, California, 93722, United States']"
376,Burger King,36.7600016,-120.3861706,"157 Derrick Ave, Mendota","['Derrick Avenue, Mendota, Fresno County, California, 93640, United States']"
377,Burger King,32.6934473,-117.1342185,"1220 S 28th St, San Diego","['1220, South 28th Street, Barrio Logan, San Diego, San Diego County, California, 92113, United States']"
378,Burger King,32.6484564,-117.063725,"97 Bonita Rd, Chula Vista","['97, Bonita Road, Sunny Vista, Chula Vista, San Diego County, California, 91910, United States']"
379,Burger King,32.6776766,-117.0982155,"815 Highland Ave, National City","['815, Highland Avenue, National City, San Diego County, California, 91950, United States']"
380,Burger King,32.6362963,-117.0212227,"899 E H St, Chula Vista","['Burger King, 899, East H Street, Rancho del Rey, Chula Vista, San Diego County, California, 91902, United States']"
381,Burger King,32.6079698,-117.0663951,"1265 3rd Ave, Chula Vista","['1265, 3rd Avenue, Castle Park, Chula Vista, San Diego County, California, 91911, United States']"
382,Burger King,32.6279454,-117.0879373,"599 Broadway, Chula Vista","['599, Broadway, Chula Vista, San Diego County, California, 91910, United States']"
383,Burger King,32.6979053,-117.1697158,"1201 1st St, Coronado","['Bike & Kayak toursp, 1201, 1st Street, Coronado, San Diego County, California, 92135, United States']"
384,Burger King,32.5842494,-117.1084012,"1180 Palm Ave, Imperial Beach","['1180, Palm Avenue, Imperial Beach, San Diego County, California, 91932, United States']"
385,Burger King Mesa,32.5008192,-116.9705656,"Blvd. Gustavo Diaz Ordaz 5231, Guillen, Tijuana",['NaN']
386,Burger King,32.6539998,-117.065369,"3030 Plaza Bonita Rd Ste 2075, National City",['NaN']
387,Burger King,32.674944,-117.0988986,"1200 Highland Ave, National City","['Walmart Supercenter, 1200, Highland Avenue, National City, San Diego County, California, 91950, United States']"
388,Burger King,32.7119054,-117.1154246,"3676 Market St, San Diego","['Burger King, 3676, Market Street, Mount Hope, San Diego, San Diego County, California, 92102, United States']"
389,Burger King,38.6773515,-121.7966087,"251 W Main St, Woodland","['251, West Main Street, Woodland, Northampton County, North Carolina, 27897, United States']"
390,Burger King,38.67684759999999,-121.7361975,"1830 E Main St, Woodland","['Burger King, 1830, East Main Street, Woodland, Yolo County, California, 95776, United States']"
391,Burger King,38.4951849,-121.4292034,"7218 Stockton Blvd, Sacramento","['Burger King, 7218, Stockton Boulevard, Elk Grove, Sacramento County, California, 95823, United States']"
392,Burger King,38.4584196,-121.8406465,"1350 Stratford Ave, Dixon","['1350, Stratford Avenue, Dixon, Solano County, California, 95620, United States']"
393,Burger King,39.1513689,-123.1935836,"711 E Perkins St, Ukiah","['East Perkins Street, Oak Manor, Ukiah, Mendocino County, California, 95482, United States']"
394,Burger King,39.0321027,-122.9259583,"1142 Lakeport Blvd, Lakeport","['Lakeport Boulevard, Lakeport, Lake County, California, 95453, United States']"
395,Burger King,36.5766959,-119.6326925,"3200 Floral Ave, Selma","['Floral Avenue, Selma, Fresno County, California, 93662, United States']"
396,Burger King,36.7055177,-119.5552316,"736 Academy Ave, Sanger","['736, Academy Avenue, Sanger, Fresno County, California, 93657, United States']"
397,Burger King,36.6045715,-119.5475681,"13609 Manning Ave, Parlier","['East Manning Avenue, Parlier, Fresno County, California, 93648, United States']"
398,Burger King,36.9411506,-120.0566024,"1230 S Madera Ave, Madera","['South Madera Avenue, Madera, Madera County, California, 93637, United States']"
399,Burger King,36.5455743,-119.4013962,"680 W El Monte Way, Dinuba","['West El Monte Way, Dinuba, Tulare County, California, 93618, United States']"
400,Burger King,38.8867822,-121.2919539,"115 Lincoln Blvd, Lincoln","['Burger King, 115, Lincoln Boulevard, Lincoln, Placer County, California, 95648, United States']"
401,Burger King,38.9417076,-121.0962626,"2905 Bell Rd, Auburn","['Briar Patch - Auburn, Bell Road, Placer County, California, 95603, United States']"
402,Burger King,39.2360272,-121.0386616,"1857 E Main St, Grass Valley","['East Main Street, Grass Valley, Nevada County, California, 95945, United States']"
403,Burger King,39.2918292,-120.6783725,"41965 Nyack Rd, Emigrant Gap","['Burger King, 41965, Nyack Road, Placer County, California, 95715, United States']"
404,Burger King,38.8631572,-121.951658,"30038 County Road 8, Dunnigan",['NaN']
405,Burger King,34.1002693,-118.0738898,"5541 Rosemead Blvd, Temple City","['5541, Rosemead Boulevard, Temple City, Los Angeles County, California, 91780, United States']"
406,Burger King,34.084934,-117.9650652,"14130 Ramona Blvd, Baldwin Park","['14130, Ramona Boulevard, Baldwin Park, Los Angeles County, California, 91706, United States']"
407,Burger King,34.0342203,-117.9744697,"14600 Valley Blvd, La Puente","['Valley Boulevard, La Puente, Los Angeles County, California, 91789, United States']"
408,Burger King,34.107233,-118.0344178,"82 Las Tunas Dr, Arcadia","['82, Las Tunas Drive, Arcadia, Los Angeles County, California, 91007, United States']"
409,Burger King,33.9855148,-118.3938878,"6000 Sepulveda Blvd, Culver City","['Best Buy, 6000, Sepulveda Boulevard, Fox Hills, Playa Vista, Culver City, Los Angeles County, California, 90230, United States']"
410,Burger King,38.1057587,-122.2319028,"1 Mariposa St, Vallejo","['1, Mariposa Street, Vallejo, Solano County, California, 94590, United States']"
411,Burger King,38.050199,-122.5321242,"220 Alameda del Prado, Novato","['220, Alameda del Prado, Novato, Marin County, California, 94949, United States']"
412,Burger King,38.0666583,-122.1655668,"828 Southampton Rd, Benicia","['828, Southampton Road, Benicia, Solano County, California, 94510, United States']"
413,Burger King,38.1237371,-122.2547865,"3606 Sonoma Blvd, Vallejo","['3606, Sonoma Boulevard, Vallejo, Solano County, California, 94590, United States']"
414,Burger King,33.8724466,-118.1182435,"10134 Artesia Blvd, Bellflower","['10134, Artesia Boulevard, Bellflower, Los Angeles County, California, 90706, United States']"
415,Burger King,41.7586087,-124.1977302,"1250 9th St, Crescent City","['1250, 9th Street, Crescent City, Del Norte County, California, 95531, United States']"
416,Burger King,42.053669,-124.287609,"835 Chetco Ave, Brookings","['Chetco Avenue, Brookings, Curry County, Oregon, 97415, United States']"
417,Burger King,37.4894954,-122.2381648,"575 El Camino Real, Redwood City",['NaN']
418,Burger King,33.8390798,-117.8857885,"2210 E Lincoln Ave, Anaheim","['2210, East Lincoln Avenue, Anaheim, Orange County, California, 92806, United States']"
419,Burger King,33.8746184,-117.8888805,"2403 E Chapman Ave, Fullerton","['2403, East Chapman Avenue, Fullerton, Orange, Fullerton, Orange County, California, 92831, United States']"
420,Burger King,33.8098966,-118.125641,"2955 N Bellflower Blvd, Long Beach","['North Bellflower Boulevard, Los Altos, Long Beach, Los Angeles County, California, 90808, United States']"
421,Burger King,38.3520105,-121.9506577,"681 Elmira Rd, Vacaville","['681, Elmira Road, Regency Park Plaza, Vacaville, Solano County, California, 95687, United States']"
422,Burger King,38.3359641,-121.9699814,"1939 Peabody Rd, Vacaville","['Peabody Road, Vacaville, Solano County, California, 95687, United States']"
423,Burger King,38.5620426,-121.7691424,"2026 Lyndell Terrace, Davis","['2026, Lyndell Terrace, Davis, Yolo County, California, 95616, United States']"
424,Burger King,38.361439,-121.971729,"1330 E Monte Vista Ave, Vacaville","['Burger King, 1330, East Monte Vista Avenue, Vacaville, Solano County, California, 95688, United States']"
425,Burger King,36.4174837,-121.3202521,"2107 H Dela Rosa Sr St, Soledad","['2107, H Dela Rosa Sr Street, Soledad Mission Shopping Center, Soledad, Monterey County, California, 93960, United States']"
426,Burger King,37.0451672,-122.0277697,"227 Mt Hermon Rd, Scotts Valley","[""227, Mount Hermon Road, King's Village Shopping Center, Scotts Valley, Santa Cruz County, California, 95066, United States""]"
427,Burger King,36.1961453,-119.3394989,"601 E Bardsley Ave, Tulare","['601, East Bardsley Avenue, Tulare, Tulare County, California, 93274, United States']"
428,Burger King,36.0511048,-119.025792,"820 S Jaye St, Porterville","['820, South Jaye Street, Porterville, Tulare County, California, 93257, United States']"
429,Burger King,36.0808556,-119.0414431,"1092 W Henderson Ave, Porterville","['1092, West Henderson Avenue, Porterville, Tulare County, California, 93257, United States']"
430,Burger King,36.2040077,-119.1044059,"955 W Hermosa St, Lindsay","['955, West Hermosa Street, Lindsay, Tulare County, California, 93247, United States']"
431,Burger King,36.3031469,-119.3142812,"3101 S Mooney Blvd, Visalia","['South Mooney Boulevard, Visalia, Tulare County, California, 93291, United States']"
432,Burger King,36.3260052,-119.3313208,"500 S Demaree St, Visalia","['500, South Demaree Street, Visalia, Tulare County, California, 93277, United States']"
433,Burger King,36.2250161,-119.3355185,"1255 N Blackstone St, Tulare","['1255, North Blackstone Street, Tulare, Tulare County, California, 93274, United States']"
434,Burger King,36.338428,-119.2792055,"1009 N Ben Maddox Way, Visalia","['1009, North Ben Maddox Way, Visalia, Tulare County, California, 93292, United States']"
435,Burger King,38.0168418,-121.9425034,"604 Bailey Rd, Bay Point","['Bailey Road, Bay Point, Contra Costa County, California, United States']"
436,Burger King,37.9976402,-121.7309712,"2505 Main St, Oakley","['Main Street, Oakley, Contra Costa County, California, 94561, United States']"
437,Burger King,38.0143384,-121.8910243,"2162 Railroad Ave, Pittsburg","['2162, Railroad Avenue, Pittsburg, Contra Costa County, California, 94565, United States']"
438,Burger King,42.2106718,-121.7565287,"2710 S 6th St, Klamath Falls","['2710, South 6th Street, Klamath Falls, Klamath County, Oregon, 97603, United States']"
439,Burger King,42.2069049,-121.7216359,"5441 S 6th St, Klamath Falls","['South 6th Street, Klamath Falls, Klamath County, Oregon, 97603, United States']"
440,Burger King,42.2501948,-121.7892174,"2561 Campus Dr, Klamath Falls","['Burger King, 2561, Campus Drive, Klamath Falls, Klamath County, Oregon, 97601, United States']"
441,Burger King,36.857588,-120.4561874,"1185 N St, Firebaugh",['NaN']
442,Burger King,37.0976608,-120.2179046,"18158 Avenue 24, Chowchilla","['Avenue 24, Chowchilla, Madera County, California, United States']"
443,Burger King,41.31143429999999,-122.3170038,"410 W Lake St, Mt Shasta","['Burger King, 410, West Lake Street, Mount Shasta, Siskiyou County, California, 96067, United States']"
444,Burger King,34.0630134,-118.0908121,"3003 San Gabriel Blvd, Rosemead","['Burger King, 3003, San Gabriel Boulevard, South San Gabriel, Rosemead, Los Angeles County, California, 91770, United States']"
445,Burger King,37.9650146,-121.7793301,"4620 Lone Tree Wy, Antioch","['Lone Tree Way, Antioch, Contra Costa County, California, 94531, United States']"
446,Burger King,41.7032855,-122.6458607,"1803 Fort Jones Rd, Yreka","['1803, Fort Jones Road, Yreka, Siskiyou County, California, 96097, United States']"
447,Burger King,36.330078,-119.391584,"9017 E Crowley Ave, Visalia",['NaN']
448,Burger King,36.2970377,-119.1556549,"West, 1118 W Visalia Rd, Exeter","['Exeter Church of the Nazarene, 400, West Visalia Road, Exeter, Tulare County, California, 93221, United States']"
449,Burger King,36.350978,-119.4245987,"6603 Betty Dr, Goshen","['6603, Betty Drive, Goshen, Tulare County, California, 93291, United States']"
450,Burger King,36.6252109,-119.3229629,"1310 Park Blvd, Orange Cove","['Park Boulevard, Orange Cove, Fresno County, California, 93646, United States']"
451,Burger King,37.9944463,-122.1193349,"7 Muir Rd, Martinez","['7, Muir Road, Martinez, Contra Costa County, California, 94553, United States']"
452,Burger King,37.9727177,-122.0635064,"677 Contra Costa Blvd, Pleasant Hill","['677, Contra Costa Boulevard, College Park, Pleasant Hill, Contra Costa County, California, 94523, United States']"
453,Burger King,37.9256553,-122.0631923,"2855 N Main St, Walnut Creek","['2855, North Main Street, Walnut Creek, Contra Costa County, California, 94597, United States']"
454,Burger King,34.0196244,-118.4698632,"1919 Pico Blvd, Santa Monica","['1919, West Pico Boulevard, Santa Monica, Los Angeles County, California, 90405, United States']"
455,Burger King,34.0004486,-118.3949442,"10812 Jefferson Blvd, Culver City","['10812, Jefferson Boulevard, Culver City, Los Angeles County, California, 90230, United States']"
456,Burger King,34.2169446,-118.4481534,"8030 Van Nuys Blvd, Panorama City","['8030, Van Nuys Boulevard, Panorama City, Los Angeles, Los Angeles County, California, 91402, United States']"
457,Burger King,34.16324300000001,-118.4491498,"5109 Van Nuys Blvd, Sherman Oaks","['5109, Van Nuys Boulevard, Sherman Oaks, Los Angeles, Los Angeles County, California, 91403, United States']"
458,Burger King,34.22105,-118.4717211,"15554 Roscoe Blvd, Van Nuys","['15554, Roscoe Boulevard, North HIlls East Neighborhood Council District, Van Nuys, Los Angeles, Los Angeles County, California, 91406, United States']"
459,Burger King,34.2009661,-118.3839505,"11546 Sherman Way, North Hollywood",['NaN']
460,Burger King,39.3989085,-123.3490098,"1355 S Main St, Willits","['South Main Street, Willits, Mendocino County, California, 95490, United States']"
461,Burger King,37.9366521,-121.6973189,"1105 2nd St, Brentwood","['Burger King, 1105, 2nd Street, Brentwood, Contra Costa County, California, 94513, United States']"
462,Burger King,37.4288893,-121.9103746,"175 W Calaveras Blvd, Milpitas","['Burger King, 175, West Calaveras Boulevard, Milpitas, Santa Clara County, California, 95035, United States']"
463,Burger King,36.202577,-121.1297453,"600 Canal St, King City","['600, Canal Street, King City, Monterey County, California, 93930, United States']"
464,Burger King,36.32893320000001,-121.245258,"520 Walnut Ave, Greenfield","['520, Walnut Avenue, Greenfield, Monterey County, California, 93927, United States']"
465,Burger King,37.46545940000001,-121.1405635,"102 Ward Ave, Patterson","['Ward Avenue, Patterson, Stanislaus County, California, 95363, United States']"
466,Burger King,33.9420227,-117.2594578,"23125 Hemlock Ave, Moreno Valley","['23125, Hemlock Avenue, Sunnymead, Moreno Valley, Riverside County, California, 92557, United States']"
467,Burger King,34.0707969,-117.3708724,"1366 S Riverside Ave, Rialto","['Walmart Supercenter, 1366, South Riverside Avenue, Rialto, San Bernardino County, California, 92376, United States']"
468,Burger King,34.0767654,-117.5511109,"4649 Mills Cir, Ontario","['Burger King, 4649, Mills Circle, Ontario Mills, Ontario, San Bernardino County, California, 91764, United States']"
469,Burger King,37.155599,-121.6495885,"1107 Cochrane Rd Suite #150, Morgan Hill",['NaN']
470,Burger King,37.1290531,-121.6374225,"830 E Dunne Ave, Morgan Hill","['Burger King, 830, East Dunne Avenue, Morgan Hill, Santa Clara County, California, 95037, United States']"
471,Burger King,32.5343104,-117.0365798,"Av. Revolución # 898, Centro, Tijuana","['Avenida Revolución, Zona Centro, Tijuana, Municipio de Tijuana, Baja California, 22055, México']"
472,Burger King,33.9742659,-118.2829553,"7201 S Figueroa St, Los Angeles","['7201, South Figueroa Street, Vermont Knolls, Los Angeles, Los Angeles County, California, 90003, United States']"
473,Burger King,33.9245953,-118.1285433,"Inside Walmart, 9001 Apollo Way, Downey",['NaN']
474,Burger King,33.9602487,-118.3020138,"1453 W Manchester Ave, Los Angeles","['1453, West Manchester Avenue, Manchester Square, Los Angeles, Los Angeles County, California, 90047, United States']"
475,Burger King,37.78008000000001,-121.9688611,"3240 Crow Canyon Rd, San Ramon","['Burger King, 3240, Crow Canyon Road, San Ramon, Contra Costa County, California, 94583, United States']"
476,Burger King,37.951262,-121.9575253,"5400 Ygnacio Valley Rd, Concord","['Ygnacio Valley Road, Cowell, Concord, Contra Costa County, California, 94521, United States']"
477,Burger King,37.9638273,-121.991246,"4320 Clayton Rd, Concord","['4320, Clayton Road, Concord, Contra Costa County, California, 94521, United States']"
478,Burger King,38.642988,-121.1903721,"171 Iron Point Rd, Folsom","['171, Iron Point Road, Folsom, Sacramento County, California, 95630, United States']"
479,Burger King,38.6781528,-121.2648794,"8034 Greenback Ln, Citrus Heights","['A&W, 8034, Greenback Lane, Citrus Heights, Sacramento County, California, 95610, United States']"
480,Burger King,38.1008708,-121.2659927,"2600 Reynolds Ranch Pkwy Suite 100, Lodi",['NaN']
