,Name,Latitude,Longitude,Address,Full Address
155,Burger King,35.3185218,-119.090866,"7990 White Ln, Bakersfield","['7990, White Lane, Bakersfield, Kern County, California, 93309, United States']"
156,Burger King,35.1320356,-118.4574273,"620 W Tehachapi Blvd, Tehachapi","['620, West Tehachapi Boulevard, Tehachapi, Kern County, California, 93561, United States']"
157,Burger King,35.3908255,-119.0034335,"3405 Union Ave, Bakersfield","['3405, Union Avenue, Bakersfield, Kern County, California, 93305, United States']"
158,Burger King,34.9921695,-118.9413887,"5552 S Wheeler Ridge Rd, Arvin",['NaN']
159,Burger King,35.209399,-118.8342653,"802 Bear Mountain Blvd, Arvin","['802, Bear Mountain Boulevard, Arvin, Kern County, California, 93203, United States']"
160,Burger King,35.6178762,-118.47725,"5600 Lake Isabella Blvd, Lake Isabella",['NaN']
161,Burger King,35.6012826,-119.3495209,"2101 CA-46, Wasco","['2101, Paso Robles Highway, Wasco, Kern County, California, 93280, United States']"
162,Burger King,35.2674156,-118.9162058,"E Panama Rd. at, Main St, Lamont",['NaN']
163,Burger King,35.6178356,-118.4772776,Lake Isabella,"['Lake Isabella, Kern County, California, United States']"
164,Burger King,35.6125418,-120.681746,"180 Niblick Rd, Paso Robles","['Walmart, 180, Niblick Road, Woodland Plaza II, Paso Robles, San Luis Obispo County, California, 93446, United States']"
165,Burger King,37.4924507,-120.8680038,"1610 W Main St, Turlock","['1610, West Main Street, Turlock, Stanislaus County, California, 95380, United States']"
166,Burger King,37.5161213,-120.8486076,"2590 Geer Rd, Turlock","['Burger King, 2590, Geer Road, Turlock, Stanislaus County, California, 95382, United States']"
167,Burger King,36.9748533,-120.0724179,"1103 Country Club Dr, Madera","['1103, Country Club Drive, Madera, Madera County, California, 93638, United States']"
168,Burger King,37.3606527,-120.6143367,"2721 Winton Way, Atwater","['Burger King, 2721, North Winton Way, Atwater, Merced County, California, 95301, United States']"
169,Burger King,37.5925767,-120.938247,"2732 Mitchell Rd, Ceres","['2732, Mitchell Road, Ceres, Stanislaus County, California, 95307, United States']"
170,Burger King,37.2881468,-120.4543175,"1965 E Childs Ave, Merced","['Burger King, 1965, East Childs Avenue, Merced, Merced County, California, 95341, United States']"
171,Burger King,37.3197324,-120.4771908,"555 W Olive Ave, Merced","['Burger King, 555, West Olive Avenue, Merced, Merced County, California, 95348, United States']"
172,Burger King,37.0565599,-120.8519483,"525 W Pacheco Blvd, Los Banos","['Burger King, 525, West Pacheco Boulevard, Los Banos, Merced County, California, 93635, United States']"
173,Burger King,37.5477152,-120.9014994,"6001 N Golden State Blvd, Turlock","['North Golden State Boulevard, Turlock, Stanislaus County, California, 95328, United States']"
174,Burger King,37.3093917,-121.0193436,"1955 N St, Newman","['Burger King, 1955, N Street, Newman, Stanislaus County, California, 95360, United States']"
175,Burger King,37.6096377,-120.9715185,"1421 E Hatch Rd, Ceres","['1421, East Hatch Road, Ceres, Stanislaus County, California, 95351, United States']"
176,Burger King,37.0546522,-121.0154817,"28991 Gonzaga Rd, Santa Nella",['NaN']
177,Burger King,38.527843,-121.4445126,"5150 Stockton Blvd, Sacramento","['5150, Stockton Boulevard, Fruitridge Manor, Sacramento, Sacramento County, California, 95820, United States']"
178,Burger King,38.6151735,-121.5389356,"2714 El Centro Rd, Sacramento","['Burger King, 2714, El Centro Road, Sacramento County, California, 95833, United States']"
179,Burger King,38.5980788,-121.4212599,"1915 Arden Way, Sacramento","['Burger King, 1915, Arden Way, Sacramento, Sacramento County, California, 95815, United States']"
180,Burger King,38.5239642,-121.49802,"5610 Freeport Blvd, Sacramento","['Burger King, 5610, Freeport Boulevard, Sacramento, Sacramento County, California, 95822, United States']"
181,Burger King,38.7616471,-121.3098116,"5121 Foothills Blvd, Roseville","['Burger King, 5121, Foothills Boulevard, Roseville, Placer County, California, 95678, United States']"
182,Burger King,38.4946916,-121.5233796,"7225 Greenhaven Dr, Sacramento","['Burger King, 7225, Greenhaven Drive, Sacramento, Sacramento County, California, 95831, United States']"
183,Burger King,38.4549656,-121.4064379,"8338 Power Inn Rd, Elk Grove","['8338, Power Inn Road, Elk Grove, Sacramento County, California, 95624, United States']"
184,Burger King,38.5895687,-121.551125,"763 Ikea Ct #120, West Sacramento","['763, Ikea Court, Riverpoint Marketplace, West Sacramento, Yolo County, California, 95605, United States']"
185,Burger King,39.1262692,-121.576362,"1101 N Beale Rd, Marysville",['NaN']
186,Burger King,33.7081288,-117.8858489,"2850 S Bristol St, Santa Ana","['2850, South Bristol Street, Santa Ana, Orange County, California, 92704, United States']"
187,Burger King,33.7090314,-117.8592186,"601 E Dyer Rd, Santa Ana","['601, East Dyer Road, Dyer, Santa Ana, Orange County, California, 92705, United States']"
188,Burger King,33.7461366,-117.9204597,"200 N Harbor Blvd, Santa Ana","['South Harbor Boulevard, Santa Ana, Orange County, California, 92704-7096, United States']"
189,Burger King,33.7823175,-118.0296414,"12401 Valley View St, Garden Grove","['12401, Valley View Street, Garden Grove, Orange County, California, 92845, United States']"
190,Burger King,33.7595162,-117.8373116,"2100 17th St, Santa Ana",['NaN']
191,Burger King,33.70056110000001,-117.9859644,"8230 Talbert Ave, Huntington Beach","['Walmart, 8230, Talbert Avenue, Liberty Park, Huntington Beach, Orange County, California, 92646, United States']"
192,Burger King,33.7788564,-118.2738527,"744 Wilmington Blvd, Wilmington","['744, North Wilmington Boulevard, Wilmington, Los Angeles, Los Angeles County, California, 90744, United States']"
193,Burger King,33.6602604,-117.8736784,"2122 South East Bristol 777!, Newport Beach",['NaN']
194,Burger King,36.3275189,-119.6494791,"301 W Lacey Blvd, Hanford","['301, West Lacey Boulevard, Hanford, Kings County, California, 93230, United States']"
195,Burger King,36.3581172,-119.6547255,"2567 N 11th Ave, Hanford","['2567, North 11th Avenue, Hanford, Kings County, California, 93230, United States']"
196,Burger King,36.3131443,-119.7817611,"65 W Hanford Armona Rd, Lemoore","['65, West Hanford Armona Road, Lemoore, Kings County, California, 93245, United States']"
197,Burger King,36.1361374,-120.3609096,"156 E Polk St, Coalinga","['156, East Polk Street, Coalinga, Fresno County, California, 93210, United States']"
198,Burger King,35.7902204,-119.2487247,"2344 Girard St, Delano","['2344, Girard Street, Delano, Kern County, California, 93215, United States']"
199,Burger King,35.1365345,-119.4467497,"309 Gardner Field Rd, Taft","['309, Gardner Field Road, Taft, Kern County, California, 93268, United States']"
200,Burger King,34.0632034,-117.2011842,"1320 Industrial Park Ave, Redlands","['1320, Industrial Park Avenue, Tri-City Shopping Center, Redlands, San Bernardino County, California, 92374, United States']"
201,Burger King,33.97592970000001,-117.3581377,"2167 University Ave, Riverside","['2167, University Avenue, Riverside, Riverside County, California, 92507, United States']"
202,Burger King,33.9196924,-116.7729199,"50900 Seminole Dr, Cabazon","['Seminole Drive, Cabazon, Riverside County, California, 92230, United States']"
203,Burger King,34.1064325,-117.39755,"1361 W Foothill Blvd, Rialto","['1361, West Foothill Boulevard, Rialto, San Bernardino County, California, 92376, United States']"
204,Burger King,34.10633790000001,-117.3613517,"503 E Foothill Blvd, Rialto","['503, East Foothill Boulevard, Rialto, San Bernardino County, California, 92376, United States']"
205,Burger King,33.5089279,-117.1277158,"30534 Rancho California Rd, Temecula","['30534, Rancho California Road, Portofino, Temeku Hills, Temecula, Riverside County, California, 92591, United States']"
206,Burger King,33.6931926,-117.3367055,"18611 Dexter Ave, Lake Elsinore","['18611, Dexter Avenue, North Elsinore, Lake Elsinore, Riverside County, California, 92532, United States']"
207,Burger King,34.0708374,-117.3707708,"120 W Valley Blvd, Rialto",['NaN']
208,Burger King,33.9395193,-117.2300515,"24800 Sunnymead Boulevard, Moreno Valley","['24800, Sunnymead Boulevard, Moreno Valley, Riverside County, California, 92553, United States']"
209,Burger King,33.8163207,-116.456556,"69-120 Ramon Rd, Cathedral City","['East Ramon Road, Cathedral City, Riverside County, California, 92276, United States']"
210,Burger King,34.1163669,-117.2783728,"935 N Waterman Ave, San Bernardino","['Waterman Avenue, San Bernardino, San Bernardino County, California, 92408-3539, United States']"
211,Burger King,34.0715633,-117.3955672,"10055 Cedar Ave, Bloomington","['Burger King, 10055, Cedar Avenue, Fontana, Bloomington, San Bernardino County, California, 92316, United States']"
212,Burger King,33.7478506,-116.9932674,"2020 W Florida Ave, Hemet","['2020, West Florida Avenue, Hemet, Riverside County, California, 92545, United States']"
213,Burger King,34.06274459999999,-117.2819006,"205 E Redlands Blvd, San Bernardino","['205, East Redlands Boulevard, Redlands, San Bernardino County, California, 92373, United States']"
214,Burger King,33.9932784,-117.0562832,"497 Sandalwood Dr, Calimesa","['497, Sandalwood Drive, Calimesa, Riverside County, California, 92320, United States']"
215,Burger King,33.5673156,-117.2065513,"40931 California Oaks Rd, Murrieta","['40931, California Oaks Road, California Oaks, Murrieta, Riverside County, California, 92562, United States']"
216,Burger King,35.2568293,-116.6876923,"979 Langford Lake Rd, Fort Irwin","['Langford Lake Road, Fort Irwin, San Bernardino County, California, 62310, United States']"
217,Burger King,34.0109104,-117.4362557,"6835 Valley Way, Riverside","['Valley Way, Sunnyslope, Jurupa Valley, Riverside County, California, 92509, United States']"
218,Burger King,33.9415398,-117.4544424,"5790 Van Buren Boulevard, Riverside","['5790, Van Buren Boulevard, Riverside, Riverside County, California, 92503, United States']"
219,Burger King,33.9369802,-117.4556494,"5200 Van Buren Boulevard, Riverside","['Walmart Supercenter, 5200, Van Buren Boulevard, Riverside, Riverside County, California, 92503, United States']"
220,Burger King,33.9090871,-117.4597733,"3630 Tyler St, Riverside","['3630, Tyler Street, Riverside, Riverside County, California, 92503, United States']"
221,Burger King,39.1451077,-121.6434188,"1581 Poole Blvd, Yuba City","['1581, Poole Boulevard, Yuba City, Sutter County, California, 95993, United States']"
222,Burger King,39.1418106,-121.6214596,"601 Colusa Ave, Yuba City","['Colusa Avenue, Yuba City, Sutter County, California, 905, United States']"
223,Burger King,39.1562296,-122.1470331,"480 E St, Williams","['480, East Street, Ray, Williams County, North Dakota, 58849, United States']"
224,Burger King,39.4992288,-121.5656304,"855 Oro Dam Blvd E, Oroville",['NaN']
225,Burger King,39.7143692,-121.7956889,"2520 Notre Dame Blvd, Chico","['2520, Notre Dame Boulevard, Chico, Butte County, California, 95928, United States']"
226,Burger King,39.7240308,-121.850253,"1104 W 2nd St, Chico","['1104, West 2nd Street, Chico, Butte County, California, 95928, United States']"
227,Burger King,39.2048847,-122.0037927,"1011 Bridge St, Colusa","['Bridge Street, Arbee, Colusa, Colusa County, California, 95932, United States']"
228,Burger King,39.3605547,-121.6873987,"1526 CA-99, Gridley","['CA 99, Gridley, Butte County, California, 95948, United States']"
229,Burger King,39.7492522,-122.2029608,"901 Newville Rd, Orland","['901, Newville Road, Orland, Glenn County, California, 95963, United States']"
230,Burger King,39.5250102,-122.212429,"455 N Humboldt Ave, Willows","['455, North Humboldt Avenue, Willows, Glenn County, California, 95988, United States']"
231,Burger King,39.1163751,-121.3890018,"Building #2453, Beale AFB",['NaN']
232,Burger King,33.6049089,-114.6057889,"379 S Lovekin Blvd, Blythe","['Burger King, 379, South Lovekin Boulevard, Blythe, Riverside County, California, 92225, United States']"
233,Burger King,33.6613377,-114.2407992,"1395 W Main St, Quartzsite","['West Main Street, Quartzsite, La Paz County, Arizona, 85346, United States']"
234,Burger King,33.9167767,-118.3672973,"5107 W El Segundo Blvd, Hawthorne","['West El Segundo Boulevard, Hawthorne, Los Angeles County, California, 90249, United States']"
235,Burger King,32.7687285,-115.5342629,"2903 S Dogwood Rd, El Centro","['South Dogwood Road, El Centro, Imperial County, California, 92243, United States']"
236,Burger King,32.6042799,-115.4780182,"Calz Anáhuac 301, Juventud Deportiva 2000, Mexicali",['NaN']
237,Burger King,32.65863760000001,-115.4774968,"Adolfo Lopez Mateos S/N Local 2-S, Revolucion, Mexicali",['NaN']
238,Burger King,32.6492187,-115.4718781,"Blvd. Lopez Mateos & C. del Hospital, Zona Industrial, Mexicali",['NaN']
239,Burger King,32.6104455,-115.3855001,"Plaza Nuevo, Blvrd Lázaro Cárdenas",['NaN']
240,Burger King Macroplaza del Valle,32.6211352,-115.5098293,"Blvrd Lázaro Cárdenas 2200, El Porvenir, Mexicali",['NaN']
241,Burger King PERIFERICO MEXICALI,32.62460430000001,-115.4162267,"Blvrd Lázaro Cárdenas 2955, Rancho la Bodega, Mexicali",['NaN']
242,Burger King,32.6399564,-115.4500734,"Boulevar Benito Juárez S/n, Jardines del Valle, Mexicali",['NaN']
243,Burger King,32.6543889,-115.4126326,"Calz. Manuel Gómez Morín 1800, Cataviña, Mexicali",['NaN']
244,Burger King,32.6241622,-115.499638,"Blvrd Lázaro Cárdenas 22, Villafontana, Mexicali",['NaN']
245,Burger King,32.5921323,-115.3557764,"Blvrd Lázaro Cárdenas 4289, Islas Agrarias Grupo A",['NaN']
246,Burger King,34.1349147,-118.1501806,"622 S Fair Oaks Ave, Pasadena","['622, South Fair Oaks Avenue, Pasadena, Los Angeles County, California, 91105, United States']"
247,Burger King,34.6569424,-120.45798,"1153 N H St, Lompoc","['Burger King, 1153, North H Street, Lompoc, Santa Barbara County, California, 93436, United States']"
248,Burger King,34.7035177,-118.1518838,"1202 W Ave I, Lancaster","['Burger King, 1202, West Avenue I, Lancaster, Los Angeles County, California, 93534, United States']"
249,Burger King,34.6756648,-118.1559626,"43627 15th St W, Lancaster","['43627, 15th Street West, Lancaster, Los Angeles County, California, 93534, United States']"
250,Burger King,33.9091967,-117.5598378,"1666 Second St, Norco",['NaN']
251,Burger King,34.1034797,-117.5315244,"12549 Foothill Blvd, Rancho Cucamonga","['Walmart, 12549, Foothill Boulevard, Rancho Cucamonga, San Bernardino County, California, 91739, United States']"
252,Burger King,38.3161819,-122.2984094,"3025 Jefferson St, Napa","['Jefferson Street, Salvador, Napa, Napa County, California, 94558, United States']"
253,Burger King,38.2431127,-122.0192038,"1260 Anderson Dr, Suisun City","['1260, Anderson Drive, Suisun City, Solano County, California, 94585, United States']"
254,Burger King,38.2755923,-122.6683831,"5304 Old Redwood Hwy N, Petaluma",['NaN']
255,Burger King,38.22142340000001,-122.12666,"190 Pittman Rd, Suisun City",['NaN']
256,Burger King,38.2595625,-122.0638503,"1475 Holiday Ln, Fairfield","['Burger King, 1475, Holiday Lane, Fairfield, Solano County, California, 94534, United States']"
257,Burger King,38.3499401,-122.7101867,"6125 Commerce Blvd, Rohnert Park","['6125, Commerce Boulevard, Rohnert Park, Sonoma County, California, 94926, United States']"
258,Burger King,38.2737729,-122.034737,"2415 N Texas St, Fairfield","['2415, North Texas Street, Fairfield, Solano County, California, 94533, United States']"
259,Burger King,38.5261476,-122.7870065,"6351 Hembree Ln, Windsor","['Hembree Lane, Shiloh, Windsor, Sonoma County, California, 95492, United States']"
260,Burger King,38.4521288,-122.770556,"2542 Guerneville Rd, Santa Rosa","['2542, Guerneville Road, Santa Rosa, Sonoma County, California, 95401, United States']"
261,Burger King,38.3643949,-122.7141912,"5020 Redwood Dr, Rohnert Park","['5020, Redwood Drive, Wilfred, Rohnert Park, Sonoma County, California, 94926, United States']"
262,Burger King,38.4073026,-122.8387377,"700 Gravenstein Hwy N, Sebastopol","['700, Gravenstein Highway North, Sebastopol, Sonoma County, California, 95472, United States']"
263,Burger King,38.4582022,-122.6747381,"56 Mission Cir, Santa Rosa","['56, Mission Circle, Santa Rosa, Sonoma County, California, 95409, United States']"
264,Burger King,38.3310148,-122.7146459,"8510 Gravenstein Hwy, Cotati","['8510, Gravenstein Highway, Cotati, Sonoma County, California, 94931, United States']"
265,Burger King,38.4283503,-122.7420037,"741 Stony Point Rd, Santa Rosa","['741, Stony Point Road, Santa Rosa, Sonoma County, California, 95407, United States']"
266,Burger King,34.2180259,-119.0393805,"181 Arneill Rd, Camarillo","['Burger King, 181, Arneill Road, Old Town, Camarillo, Ventura County, California, 93010, United States']"
267,Burger King,34.2213139,-119.177936,"2001 N Oxnard Blvd, Oxnard","['2001, North Oxnard Boulevard, Oxnard, Ventura County, California, 93036, United States']"
268,Burger King,34.2013653,-118.5952841,"21227 Sherman Way, Canoga Park","['21227, Sherman Way, Canoga Park, Los Angeles, Los Angeles County, California, 91303, United States']"
269,Burger King,34.2353634,-118.5030062,"9025 Balboa Blvd, Northridge","['9025, Balboa Boulevard, Northridge, Los Angeles, Los Angeles County, California, 91325, United States']"
270,Burger King,34.235067,-118.5613727,"19640 Nordhoff St, Northridge","['19640, Nordhoff Street, Northridge, Los Angeles, Los Angeles County, California, 91324, United States']"
271,Burger King,34.256937,-118.5876807,"20838 Devonshire St, Chatsworth","['20838, Devonshire Street, Chatsworth, Los Angeles, Los Angeles County, California, 91311, United States']"
272,Burger King,34.2240125,-119.1498437,"2800 Paseo Mercado, Oxnard","['2800, Paseo Mercado, Marketplace At Oxnard, Owl Mobile Manor, Oxnard, Ventura County, California, 93036, United States']"
273,Burger King,34.2777213,-119.2140225,"5950 Telegraph Rd, Ventura","['Burger King, 5950, Telegraph Road, Ventura, Ventura County, California, 93003, United States']"
274,Burger King,34.2814096,-119.3011292,"21 W Main St, Ventura","['Burger King, 21, West Main Street, Ventura, Ventura County, California, 93001, United States']"
275,Burger King,34.1764272,-119.1945893,"2500 S Ventura Rd, Oxnard","['South Ventura Road, Oxnard, Ventura County, California, 93030-6506, United States']"
276,Burger King,34.1450412,-118.7600586,"29136 Roadside Dr, Agoura Hills","['29136, Roadside Drive, Malibu Junction, Agoura Hills, Los Angeles County, California, 91301, United States']"
277,Burger King,34.2371097,-118.5285895,"18111 Nordhoff St, Northridge","['Freudian Sip, 18111, Nordhoff Street, Northridge, Los Angeles, Los Angeles County, California, 91330-8272, United States']"
278,Burger King,34.2713557,-118.7774133,"1152 E Los Angeles Ave, Simi Valley","['1152, East Los Angeles Avenue, Simi Valley, Ventura County, California, 93065, United States']"
279,Burger King,37.5418711,-122.3020135,"2817 S El Camino Real, San Mateo",['NaN']
280,Burger King,37.3782378,-121.9400293,"2532 Channing Ave, San Jose","['Burger King, 2532, Channing Avenue, San Jose, Santa Clara County, California, 95131, United States']"
281,Burger King,37.3518866,-121.9997475,"3750 El Camino Real, Santa Clara","['Burger King, 3750, El Camino Real, Santa Clara, Santa Clara County, California, 95051-4409, United States']"
282,Burger King,37.4804679,-122.2185642,"2102 Middlefield Rd, Redwood City","['2102, Middlefield Road, Redwood Junction, Redwood City, San Mateo County, California, 94063, United States']"
283,Burger King,37.6184179,-122.3860744,"San Francisco International Airport, San Francisco","['San Francisco International Airport, 780, South Airport Boulevard, South San Francisco, San Mateo County, California, 94128, United States']"
284,Burger King,37.6996136,-121.9045946,"5315 Hopyard Rd, Pleasanton","['Burger King, 5315, Hopyard Road, Pleasanton, Alameda County, California, 94588, United States']"
285,Burger King,37.4155015,-121.8785913,"1475 Dempsey Rd, Milpitas","['Burger King, 1475, Dempsey Road, Milpitas, Santa Clara County, California, 95035, United States']"
286,Burger King,37.3528186,-121.9585231,"1925 El Camino Real, Santa Clara","['1925, El Camino Real, Santa Clara, Santa Clara County, California, 95050, United States']"
287,Burger King,37.5323809,-121.9586639,"3996 Washington Blvd, Fremont","['3996, Washington Boulevard, Irvington District, Fremont, Alameda County, California, 94538, United States']"
288,Burger King,34.036725,-117.7489542,"1908 S Garey Ave, Pomona","['1908, South Garey Avenue, Pomona, Los Angeles County, California, 91766, United States']"
289,Burger King,34.0647513,-117.5565999,"4325 E Guasti Rd, Ontario","['East Guasti Road, Old Guasti Winery, Guasti, Ontario, San Bernardino County, California, 91743, United States']"
290,Burger King,34.0769431,-117.6899178,"9710 Central Ave, Montclair","['9710, Central Avenue, Montclair, San Bernardino County, California, 91763, United States']"
291,Burger King,34.0333067,-117.6869777,"5451 Philadelphia St, Chino","['5451, Philadelphia Street, Chino, San Bernardino County, California, 91710, United States']"
292,Burger King,37.3652266,-121.8923074,"1181 Old Oakland Rd, San Jose","['Oakland Road, San Jose, Santa Clara County, California, 95035-8004, United States']"
293,Burger King,37.3955092,-122.0293544,"773 N Mathilda Ave, Sunnyvale","['773, North Mathilda Avenue, Sunnyvale, Santa Clara County, California, 94085, United States']"
294,Burger King,37.3337483,-121.8542767,"1030 McLaughlin Ave, San Jose","['Burger King, 1030, McLaughlin Avenue, Little Saigon, San Jose, Santa Clara County, California, 95122, United States']"
295,Burger King,37.3375894,-121.9380417,"1305 N Bascom Ave, San Jose","['1305, North Bascom Avenue, San Jose, Santa Clara County, California, 95128, United States']"
296,Burger King,37.3198376,-121.9738739,"385 Kiely Blvd, San Jose","['Burger King, 385, South Kiely Boulevard, San Jose, Santa Clara County, California, 95129, United States']"
297,Burger King,37.2904555,-121.8804916,"2390 Almaden Rd, San Jose","['Burger King, 2390, Almaden Road, San Jose, Santa Clara County, California, 95125, United States']"
298,Burger King,37.3092477,-121.9937847,"5154 Moorpark Ave, San Jose","['Lakshmi Bazaar, 5154, Moorpark Avenue, San Jose, Santa Clara County, California, 95129, United States']"
299,Burger King,37.2499527,-121.8635983,"936 Blossom Hill Rd, San Jose","['Burger King, 936, Blossom Hill Road, Alamitos, San Jose, Santa Clara County, California, 95123, United States']"
300,Burger King,37.3557075,-121.8191676,"3098 Story Rd, San Jose","['Burger King, 3098, Story Road, Alum Rock, San Jose, Santa Clara County, California, 95127, United States']"
301,Burger King,37.3704982,-121.8442556,"329 N Capitol Ave, San Jose","['329, North Capitol Avenue, San Jose, Santa Clara County, California, 95133, United States']"
302,Burger King,37.2944268,-121.832926,"635 E Capitol Expy, San Jose","['635, East Capitol Expressway, Spartan Keyes, San Jose, Santa Clara County, California, 95111, United States']"
303,Burger King,37.29450629999999,-121.9505359,"49 W Hamilton Ave, Campbell","['Burger King, 49, West Hamilton Avenue, Campbell, Santa Clara County, California, 95008, United States']"
304,Burger King,37.3044955,-121.8615358,"2170 Monterey Rd, San Jose","['Burger King, 2170, Monterey Road, Spartan Keyes, San Jose, Santa Clara County, California, 95112, United States']"
305,Burger King,37.2792241,-121.8358374,"4040 Monterey Rd, San Jose","['Burger King, 4040, Monterey Road, Seven Trees, San Jose, Santa Clara County, California, 95111, United States']"
306,Burger King,37.0213328,-121.5680895,"450 Leavesley Rd, Gilroy","['450, Leavesley Road, Gilroy, Santa Clara County, California, 95020, United States']"
307,Burger King,37.2207827,-121.8618844,"6477 Almaden Rd Spc D-1a, San Jose",['NaN']
308,Burger King,32.819862,-117.1730331,"6401 Balboa Ave, San Diego","['Burger King, 6401, Balboa Avenue, Clairemont, San Diego, San Diego County, California, 92111-2201, United States']"
309,Burger King,32.7618864,-117.0656535,"6135 El Cajon Blvd, San Diego","['6135, El Cajon Boulevard, Mid-City, San Diego, San Diego County, California, 92115, United States']"
310,Burger King,32.9068805,-117.1730718,"6735 Mira Mesa Blvd, San Diego","['6735, Mira Mesa Boulevard, San Diego, San Diego County, California, 92121-4311, United States']"
311,Burger King,32.7520021,-117.2037323,"3747 Rosecrans St, San Diego","['3747, Rosecrans Street, Old Town, San Diego, San Diego County, California, 92110, United States']"
312,Burger King,32.8799763,-117.2358375,"9500 Gilman Dr, San Diego","['28, Gilman Drive, University City, San Diego, San Diego County, California, 92093, United States']"
313,Burger King,32.7427111,-117.0479182,"6960 Broadway, Lemon Grove","['6960, Broadway, Lemon Grove, San Diego County, California, 91945, United States']"
314,Burger King,32.7180234,-117.1548933,"1210 11th Ave, San Diego","[""1210, 11th Avenue, Core District, Banker's Hill, San Diego, San Diego County, California, 92101, United States""]"
315,Burger King,32.8058687,-116.9714704,"822 N Johnson Ave, El Cajon","['Burger King, 822, North Johnson Avenue, El Cajon, San Diego County, California, 92020, United States']"
316,Burger King,33.1138799,-117.1019572,"1310 W Valley Pkwy, Escondido","['Burger King, 1310, West Valley Parkway, Escondido, San Diego County, California, 92029, United States']"
317,Burger King,33.1034978,-117.0761753,"1677 S Centre City Pkwy, Escondido","['Burger King, 1677, South Centre City Parkway, Escondido, San Diego County, California, 92025, United States']"
318,Burger King,33.1999311,-117.2464682,"377 Vista Village Dr, Vista","['Burger King, 377, Vista Village Drive, Vista, San Diego County, California, 92083, United States']"
