,Name,Latitude,Longitude,Address,Full Address
481,Burger King,33.9402993,-117.9700944,"2101 W Whittier Blvd, La Habra","['Burger King, 2101, West Whittier Boulevard, La Habra, Orange County, California, 90631, United States']"
482,Burger King,34.0990633,-117.8720409,"1070 N Grand Ave, Covina","['1070, North Grand Avenue, Covina, Los Angeles County, California, 91724, United States']"
483,Burger King,34.1399453,-118.0072269,"354 W Huntington Dr, Monrovia","['354, West Huntington Drive, Monrovia, Los Angeles County, California, 91016, United States']"
484,Burger King,33.9013212,-118.3094957,"14311 Western Ave, Gardena","['14311, South Western Avenue, Strawberry Park, Gardena, Los Angeles County, California, 90249, United States']"
485,Burger King,33.839414,-118.2856134,"20950 S Figueroa St, Carson","['20950, S Figueroa Street, Carson, Los Angeles County, California, 90745, United States']"
486,Burger King,34.5797618,-118.0826774,"2606 E Palmdale Blvd, Palmdale","['2606, East Palmdale Boulevard, Palmdale, Los Angeles County, California, 93550, United States']"
487,Burger King,34.6007616,-118.1481866,"39519 10th St W, Palmdale","['10th Street West, Palmdale, Los Angeles County, California, 93551-3713, United States']"
488,Burger King,34.6605842,-118.2040006,"4107 W Ave L, Lancaster","['4107, West Avenue L, Lancaster, Los Angeles County, California, 93536, United States']"
489,Burger King,34.2981603,-118.4382686,"2008 Glenoaks Blvd, San Fernando","['Glenoaks Boulevard, San Fernando, Los Angeles County, California, 91340, United States']"
490,Burger King,34.575708,-118.046252,"38137 47th St E, Palmdale","['38137, 47th Street East, Palmdale, Los Angeles County, California, 93552, United States']"
491,Burger King,34.6022784,-118.1848236,"3045 Rancho Vista Blvd, Palmdale","['3045, East Avenue P, Palmdale, Los Angeles County, California, 93550, United States']"
492,Burger King,37.6975019,-121.7429607,"4341 First St, Livermore","['Burger King, 4341, First Street, The Estate Collection, Livermore, Alameda County, California, 94551, United States']"
493,Burger King,34.1152621,-118.2458952,"3101 N San Fernando Rd, Los Angeles",['NaN']
494,Burger King,33.9599289,-118.2536924,"1202 Firestone Blvd, Los Angeles","['1202, Firestone Boulevard, Florence-Firestone, Los Angeles County, California, 90001, United States']"
495,Burger King,39.5570038,-119.7919379,"2901 Clear Acre Ln, Reno","['2901, Clear Acre Lane, North Valley, Reno, Washoe County, Nevada, 89512, United States']"
496,Burger King,39.5241015,-119.7680502,"1055 S Rock Blvd, Sparks","['Rock Boulevard, Sparks, Washoe County, Nevada, 89431, United States']"
497,Burger King,39.5265474,-119.8281813,"1105 W 4th St, Reno","['1105, West 4th Street, Powning Addition, Reno, Washoe County, Nevada, 89503, United States']"
498,Burger King,39.5360374,-119.7372852,"285 N McCarran Blvd, Sparks","['Burger King, 285, North McCarran Boulevard, Sparks, Washoe County, Nevada, 89431, United States']"
499,Burger King,39.5137285,-119.7895914,"1155 Kietzke Ln, Reno","['1155, Kietzke Lane, Reno, Washoe County, Nevada, 89502, United States']"
500,Burger King,39.53400329999999,-119.8663813,"5145 Mae Anne Ave, Reno","['5145, Mae Anne Avenue, Reno, Washoe County, Nevada, 89523, United States']"
501,Burger King,39.6049014,-119.8367947,"1025 N Hills Blvd, Reno","['1025, North Hills Boulevard, Reno, Washoe County, Nevada, 89506, United States']"
502,Burger King,39.6390748,-119.7106056,"9700 Pyramid Way, Sparks","['Pyramid Way, Sparks, Washoe County, Nevada, 89431-5025, United States']"
503,Burger King,39.4523772,-119.776646,"76 E Patriot Blvd, Reno","['76, East Patriot Boulevard, Reno, Washoe County, Nevada, 89511, United States']"
504,Burger King,37.5504626,-122.0503834,"34943 Newark Blvd, Newark","['Burger King, 34943, Newark Boulevard, Newark, Alameda County, California, 94555, United States']"
505,Burger King,37.4904648,-121.9280519,"46700 Mission Blvd, Fremont","['Burger King, 46700, Mission Boulevard, Warm Springs District, Fremont, Alameda County, California, 94539, United States']"
506,Burger King,33.8771899,-117.5857472,"1146 W 6th St, Corona","['1146, West 6th Street, Corona, Riverside County, California, 92882, United States']"
507,Burger King,33.9960485,-117.7190995,"3943 Grand Ave, Chino","['Walmart Supercenter, 3943, Grand Avenue, Chino, San Bernardino County, California, 91710, United States']"
508,Burger King,34.4748088,-114.3454928,"55 N Lake Havasu Ave, Lake Havasu City",['NaN']
509,Burger King,35.1216571,-114.5872473,"1751 AZ-95 #5, Bullhead City","['Bullhead City, Mohave County, Arizona, United States']"
510,Burger King,35.0182268,-114.5985038,"4753 AZ-95, Mohave Valley","[""Mohave Valley Highway, Mojave Ranch Estates, Mohave Valley / 'Amat' 'Analy Uuhwely, Mohave County, Arizona, 86427, United States""]"
511,Burger King,33.2014854,-117.3703068,"1420 Mission Ave, Oceanside","['Burger King, 1420, Mission Avenue, Oceanside, San Diego County, California, 92058, United States']"
512,Burger King,33.4818059,-117.09716,"32110 CA-79 South, Temecula",['NaN']
513,Burger King,40.7211606,-122.9282972,"1303 Main St, Weaverville","['Main Street, Weaverville, Trinity County, California, United States']"
514,Burger King,35.6237404,-117.6703262,"139 N China Lake Blvd, Ridgecrest","['139, North China Lake Boulevard, Ridgecrest, Kern County, California, 93555, United States']"
515,Burger King,33.8591638,-118.0367821,"5545 Orangethorpe Ave, La Palma","['5545, Orangethorpe Avenue, La Palma, Orange County, California, 90623, United States']"
516,Burger King,33.8581729,-117.9247436,"1329 S Harbor Blvd, Fullerton","['1329, South Harbor Boulevard, Fullerton, Orange County, California, 92832, United States']"
517,Burger King,33.9434211,-118.2010889,"4040 Tweedy Blvd, South Gate","['4040, Tweedy Boulevard, South Gate, Los Angeles County, California, 90280, United States']"
518,Burger King,39.1904382,-119.7723645,"3589 N Carson St, Carson City","['Burger King, 3589, North Carson Street, Carson City, Nevada, 89706, United States']"
519,Burger King,38.935647,-119.7382144,"1325 Highway 395 South, Gardnerville",['NaN']
520,Burger King,38.2720821,-121.9875754,"2005 Huntington Dr, Fairfield","['2005, Huntington Drive, Fairfield, Solano County, California, 94533, United States']"
521,Burger King,38.2692561,-121.9475354,"690 Airmen Dr, Travis AFB",['NaN']
522,Burger King,40.4155903,-120.6511158,"1520 Main St, Susanville","['Main Street, Susanville, Lassen County, California, 96130, United States']"
523,Burger King,37.7025868,-121.933195,"6921 Regional St, Dublin","['Burger King, 6921, Regional Street, Dublin, Alameda County, California, 94588, United States']"
524,Burger King,34.1053167,-117.6699,"910 N Mountain Ave, Upland","['910, North Mountain Avenue, Upland, San Bernardino County, California, 91786, United States']"
