,MDName,Latitude,Longitude,Address,Full Address
629,McDonald's,34.424005,-119.288557,"11444 N Ventura Ave, Ojai","['North Ventura Avenue, Matilija, Ojai, Ventura County, California, 93023, United States']"
630,McDonald's,36.3267864,-121.249048,"501 El Camino Real, Greenfield","['501, El Camino Real, Greenfield, Monterey County, California, 93927, United States']"
631,McDonald's,36.2024773,-121.1361362,"1350 Broadway Cir, King City","['Broadway Circle, King City, Monterey County, California, 93930, United States']"
632,McDonald's,36.8589614,-121.4012842,"151 San Felipe Rd, Hollister","[""McDonald's, 151, San Felipe Road, Cottage Corners, Hollister, San Benito County, California, 95023-3029, United States""]"
633,McDonald's,39.0940874,-120.9513141,"501 S Auburn St, Colfax","['501, South Auburn Street, Colfax, Placer County, California, 95713, United States']"
634,McDonald's,38.941821,-121.0959523,"2865 Bell Rd, Auburn","['Briar Patch - Auburn, Bell Road, Placer County, California, 95603, United States']"
635,McDonald's,39.2373587,-121.0378186,"11954 Nevada City Hwy, Grass Valley","['Nevada City Highway, Glenbrook, Grass Valley, Nevada County, California, 95954, United States']"
636,McDonald's,38.8072227,-121.2049725,"4211 Sierra College Blvd, Rocklin","['4211, Sierra College Boulevard, Loomis, Rocklin, Placer County, California, 95677, United States']"
637,McDonald's,38.8888908,-121.2930912,"290 G St, Lincoln","['290, G Street, South Bottoms, South Salt Creek, Lincoln, Lancaster County, Nebraska, 68508, United States']"
638,McDonald's,38.922352,-121.055976,"13370 Lincoln Way, Auburn","['13370, Lincoln Way, Auburn, Placer County, California, 95603, United States']"
639,McDonald's,38.8753612,-121.2964558,"505 CA-65, Lincoln","['505, Lincoln Boulevard, Lincoln, Placer County, California, 95648, United States']"
640,McDonald's,36.706472,-119.771254,"3110 E Jensen Ave, Fresno","['3110, East Jensen Avenue, Fresno, Fresno County, California, 93706, United States']"
641,McDonald's,36.7586769,-119.7901408,"1248 N Blackstone Ave, Fresno","['North Blackstone Avenue, Fresno, Fresno County, California, 93701, United States']"
642,McDonald's,36.757883,-119.832049,"1718 W Olive Ave, Fresno","['1718, West Olive Avenue, Fresno, Fresno County, California, 93728, United States']"
643,McDonald's,38.3356645,-122.6766899,"1702 E Cotati Ave, Rohnert Park","[""McDonald's, 1702, East Cotati Avenue, M Section, Rohnert Park, Sonoma County, California, 94928, United States""]"
644,McDonald's,34.1065083,-117.6494596,"100 E Foothill Blvd, Upland","['100, East Foothill Boulevard, Upland, San Bernardino County, California, 91786, United States']"
645,McDonald's,34.033437,-117.629804,"1170 E Philadelphia St, Ontario","['1170, East Philadelphia Street, Ontario, San Bernardino County, California, 91761, United States']"
646,McDonald's,34.001056,-117.7223061,"3770 Grand Ave, Chino","['3770, Grand Avenue, Chino, San Bernardino County, California, 91710, United States']"
647,McDonald's,34.1069157,-117.5593496,"11198 Foothill Blvd, Rancho Cucamonga","['11198, Foothill Boulevard, Rancho Cucamonga, San Bernardino County, California, 91730, United States']"
648,McDonald's,37.2751566,-121.8652533,"715 Capitol Expressway Auto Mall, San Jose","['715, Capitol Expressway Auto Mall, Branham, San Jose, Santa Clara County, California, 95136, United States']"
649,McDonald's,37.2455772,-121.888203,"1365 Blossom Hill Rd, San Jose","[""McDonald's, 1365, Blossom Hill Road, San Jose, Santa Clara County, California, 95118, United States""]"
650,McDonald's,37.2620801,-121.9220163,"1869 Camden Ave, San Jose","[""McDonald's, 1869, Camden Avenue, San Jose, Santa Clara County, California, 95124, United States""]"
651,McDonald's,37.3009345,-121.7723522,"4838 San Felipe Rd, San Jose","[""McDonald's, 4838, San Felipe Road, Evergreen, San Jose, Santa Clara County, California, 95135, United States""]"
652,McDonald's,37.2608708,-121.8758937,"4800 Almaden Expy, San Jose","[""McDonald's, 4800, Almaden Expressway, Branham, San Jose, Santa Clara County, California, 95118, United States""]"
653,McDonald's,37.250943,-121.831873,"456 Blossom Hill Rd, San Jose","['McDonald’s, 456, Blossom Hill Road, Parkview, San Jose, Santa Clara County, California, 95123, United States']"
654,McDonald's,37.2664285,-121.8322662,"163 Branham Ln, San Jose","['163, Branham Lane, Parkview, San Jose, Santa Clara County, California, 95136, United States']"
655,McDonald's,37.1506177,-121.6552618,"135 Cochrane Plaza, Morgan Hill","['Cochrane Plaza Shopping Center, Morgan Hill, Santa Clara County, California, United States']"
656,McDonald's,37.133219,-121.631335,"17025 Condit Rd, Morgan Hill","['17025, Condit Road, Morgan Hill, Santa Clara County, California, 95037, United States']"
657,McDonald's,37.231658,-121.773251,"105 Bernal Rd, San Jose","[""McDonald's, 105, Bernal Road, San Jose, Santa Clara County, California, 95119, United States""]"
658,McDonald's,37.2546115,-121.7998137,"5508 Monterey Rd, San Jose","[""McDonald's, 5508, Monterey Road, San Jose, Santa Clara County, California, 95138, United States""]"
659,McDonald's,37.949392,-121.2895268,"322 S Center St, Stockton","['South Center Street, The Homestead, Stockton, San Joaquin County, California, 95206, United States']"
660,McDonald's,32.6404251,-117.0985722,"725 E St, Chula Vista","[""McDonald's, 725, E Street, Chula Vista, San Diego County, California, 91910, United States""]"
661,McDonald's,32.647165,-116.966738,"2254 Otay Lakes Rd, Chula Vista","[""McDonald's, 2254, Otay Lakes Road, Eastlake Greens, Chula Vista, San Diego County, California, 91913, United States""]"
662,McDonald's,32.6269561,-117.0874542,"619 Broadway, Chula Vista","['619, Broadway, Chula Vista, San Diego County, California, 91910, United States']"
663,McDonald's,37.7245775,-121.9432291,"21001 San Ramon Valley Blvd, San Ramon","['Starbucks, 21001, San Ramon Valley Boulevard, San Ramon, Contra Costa County, California, 94583, United States']"
664,McDonald's,37.724882,-122.157056,"1287 Washington St, San Leandro",['NaN']
665,McDonald's,37.9942244,-122.1009551,"1185 Arnold Dr, Martinez","['1185, Arnold Drive, Village Oaks Shopping Center, Martinez, Contra Costa County, California, 94553, United States']"
666,McDonald's,37.892388,-122.114001,"3459 Mt Diablo Blvd, Lafayette","['3459, Mount Diablo Boulevard, Lafayette, Contra Costa County, California, 94549, United States']"
667,McDonald's,37.7743639,-121.9765951,"2481 San Ramon Valley Blvd, San Ramon","['2481, San Ramon Valley Boulevard, San Ramon, Contra Costa County, California, 94583, United States']"
668,McDonald's,37.96653,-122.060827,"107 Sun Valley Mall, Concord","['Sun Valley Mall, College Park, Concord, Pleasant Hill, Contra Costa County, California, 94523, United States']"
669,McDonald's,37.7681989,-122.1741668,"7300 Bancroft Ave, Oakland","['Bancroft Avenue, Seminary Park, Oakland, Alameda County, California, 94619, United States']"
670,McDonald's,37.953539,-122.059752,"1690 Contra Costa Blvd, Pleasant Hill","[""McDonald's, 1690, Contra Costa Boulevard, Ellinwood, Pleasant Hill, Contra Costa County, California, 94523, United States""]"
671,McDonald's,38.634506,-121.3286982,"7329 Fair Oaks Blvd, Carmichael","['Fair Oaks Boulevard, Carmichael, Sacramento County, California, 95609-0579, United States']"
672,McDonald's,34.00843,-118.220183,"3737 S Soto St, Vernon",['NaN']
673,McDonald's,34.3919893,-118.470845,"19401 Golden Valley Rd, Santa Clarita","['Golden Valley Road, Santa Clarita, Los Angeles County, California, 91351, United States']"
674,McDonald's,34.5587865,-118.0461558,"37217 47th St E, Palmdale","['37217, 47th Street East, Pearland, Palmdale, Los Angeles County, California, 93552, United States']"
675,McDonald's,34.496974,-118.623549,"27701 Lake Hughes Rd, Castaic","['27701, Lake Hughes Road, Castaic, Los Angeles County, California, 91384, United States']"
676,McDonald's,34.5583557,-118.0853748,"2427 E Ave S, Palmdale","['2427, East Avenue S, Palmdale, Los Angeles County, California, 93550, United States']"
677,McDonald's,34.2496909,-118.4670916,"9860 Sepulveda Blvd, North Hills","[""McDonald's, 9860, Sepulveda Boulevard, North HIlls East Neighborhood Council District, North Hills, Los Angeles, Los Angeles County, California, 91345, United States""]"
678,McDonald's,34.274472,-118.412148,"11240 Glenoaks Blvd, Pacoima","['11240, Glenoaks Boulevard, Pacoima, Los Angeles, Los Angeles County, California, 91331, United States']"
679,McDonald's,34.4928439,-118.1972748,"3750 Sierra Hwy, Acton",['NaN']
680,McDonald's,34.3035124,-118.477862,"12860 Encinitas Ave, Sylmar","[""McDonald's, 12860, Encinitas Avenue, Los Angeles, Los Angeles County, California, 91312, United States""]"
681,McDonald's,34.2568917,-118.5896105,"20932 Devonshire St, Chatsworth","['20932, Devonshire Street, Chatsworth, Los Angeles, Los Angeles County, California, 91311, United States']"
682,McDonald's,37.6826359,-121.7781392,"283 N P St, Livermore","['North P Street, Livermore, Alameda County, California, 94551, United States']"
683,McDonald's,37.7108074,-121.7236768,"805 N Vasco Rd, Livermore","[""McDonald's, 805, North Vasco Road, Centra, Livermore, Alameda County, California, 94550, United States""]"
684,McDonald's,37.6996199,-121.7424846,"4528 Las Positas Rd, Livermore","[""McDonald's, 4528, Las Positas Road, The Estate Collection, Livermore, Alameda County, California, 94550, United States""]"
685,McDonald's,37.8896692,-121.6206653,"14896 CA-4, Discovery Bay","['14896, CA 4, Discovery Bay, Contra Costa County, California, 94505, United States']"
686,McDonald's,36.0648502,-119.0086169,"379 E Olive Ave, Porterville","['379, East Olive Avenue, Porterville, Tulare County, California, 93257, United States']"
687,McDonald's,36.2262873,-119.3373473,"768 E Prosperity Ave, Tulare","['768, East Prosperity Avenue, Tulare, Tulare County, California, 93274, United States']"
688,McDonald's,37.8267508,-121.2345839,"1137 W Lathrop Rd, Manteca",['NaN']
689,McDonald's,39.5277329,-119.7011334,"2095 Brierley Way, Sparks","['2095, Brierley Way, Vista, Sparks, Washoe County, Nevada, 89434, United States']"
690,McDonald's,39.5316702,-119.8653375,"5148 Mae Anne Ave, Reno","['5148, Mae Anne Avenue, Reno, Washoe County, Nevada, 89523, United States']"
691,McDonald's,39.5457533,-119.7811112,"1810 Silverada Blvd, Reno","[""McDonald's, 1810, Silverada Boulevard, Reno, Washoe County, Nevada, 89431, United States""]"
692,McDonald's,39.514472,-119.788713,"1150 Kietzke Ln, Reno","['1150, Kietzke Lane, Reno, Washoe County, Nevada, 89502, United States']"
693,McDonald's,39.484662,-119.7476318,"3308 S McCarran Blvd, Reno","['3308, South McCarran Boulevard, Donner Springs, Reno, Washoe County, Nevada, 89502, United States']"
694,McDonald's,39.5422918,-119.735865,"610 E Prater Way, Sparks","['610, East Prater Way, Sparks, Washoe County, Nevada, 89431, United States']"
695,McDonald's,39.6251189,-119.8825389,"10595 Stead Blvd, Reno","['10595, Stead Boulevard, Reno, Washoe County, Nevada, 89506, United States']"
696,McDonald's,39.4235605,-119.7419402,"1071 Steamboat Pkwy, Reno","[""McDonald's, 1071, Steamboat Parkway, Reno, Washoe County, Nevada, 89521, United States""]"
697,McDonald's,39.3938417,-119.7654397,"18200 Wedge Pkwy, Reno","['18200, Wedge Parkway, Reno, Washoe County, Nevada, 89511, United States']"
698,McDonald's,39.6123193,-119.8494458,"120 Lemmon Dr, Reno","['Lemmon Drive, Reno, Washoe County, Nevada, 89506, United States']"
699,McDonald's,39.5560763,-119.7547223,"2905 N McCarran Blvd, Sparks","['2905, North McCarran Boulevard, Sparks, Washoe County, Nevada, 89431, United States']"
700,McDonald's,39.439552,-119.757009,"735 S Meadows Pkwy, Reno","['Chevron, 735, South Meadows Parkway, Reno, Washoe County, Nevada, 89511, United States']"
701,McDonald's,39.5776565,-119.7810549,"140 W 1st Ave, Sun Valley",['NaN']
702,McDonald's,39.5060999,-119.8002702,"305 E Plumb Ln, Reno","['East Plumb Lane, Reno, Washoe County, Nevada, 89510, United States']"
703,McDonald's,39.5278787,-119.8269916,"440 Keystone Ave, Reno","['440, Keystone Avenue, Powning Addition, Reno, Washoe County, Nevada, 89503, United States']"
704,McDonald's,39.4814273,-119.7908342,"5000 S Virginia St, Reno","['5000, South Virginia Street, Reno, Washoe County, Nevada, 89502, United States']"
705,McDonald's,39.320797,-120.208719,"11420 Deerfield Dr, Truckee","['11420, Deerfield Drive, Gateway, Truckee, Nevada County, California, 96161, United States']"
706,McDonald's,39.639616,-119.711696,"9725 Pyramid Way, Spanish Springs",['NaN']
707,McDonald's,39.5059806,-119.7745844,"2001 E Plumb Ln, Reno","['2001, East Plumb Lane, Reno, Washoe County, Nevada, 89502, United States']"
708,McDonald's,37.3320082,-119.6550647,"40112 CA-41, Oakhurst","['40112, Southern Yosemite Highway, Oakhurst, Madera County, California, 93644, United States']"
709,McDonald's,34.1946457,-118.3492434,"2565 N Hollywood Way, Burbank","['North Hollywood Way, McNeil, Burbank, Los Angeles County, California, 91505, United States']"
710,McDonald's,34.1885577,-118.3197517,"1127 N San Fernando Blvd, Burbank","['San Fernando Boulevard, Burbank, Los Angeles County, California, 91502, United States']"
711,McDonald's,37.9878161,-121.2460563,"4419 Waterloo Rd, Stockton","[""McDonald's, 4419, Waterloo Road, Stockton, San Joaquin County, California, 95215, United States""]"
712,McDonald's,37.0471688,-122.0325951,"259 Mt Hermon Rd, Scotts Valley","['259, Mount Hermon Road, Scotts Valley, Santa Cruz County, California, 95066, United States']"
713,McDonald's,37.1112764,-121.642001,"201 Vineyard Town Ctr, Morgan Hill","['Vineyard Town Center, Morgan Hill, Santa Clara County, California, United States']"
714,McDonald's,38.7045012,-121.2714598,"7632 Sunrise Blvd, Citrus Heights","['7632, Sunrise Boulevard, Citrus Heights, Sacramento County, California, 95610, United States']"
715,McDonald's,36.8085388,-119.8841854,"5222 W Shaw Ave, Fresno","['5222, West Shaw Avenue, Highway City, Fresno, Fresno County, California, 93722, United States']"
716,McDonald's,36.779421,-119.861733,"3798 W Shields Ave, Fresno","['3798, West Shields Avenue, Fresno, Fresno County, California, 93722, United States']"
717,McDonald's,34.0831146,-118.2228148,"2224 N Figueroa St, Los Angeles","['2224, N Figueroa Street, Dayton Avenue, Los Angeles, Los Angeles County, California, 90065, United States']"
718,McDonald's,37.5343206,-121.9667494,"40708 Grimmer Blvd, Fremont","[""McDonald's, 40708, Grimmer Boulevard, Irvington District, Fremont, Alameda County, California, 94538, United States""]"
719,McDonald's,37.5111849,-122.2657667,"180 El Camino Real, San Carlos","[""McDonald's, 180, El Camino Real, San Carlos, San Mateo County, California, 94070, United States""]"
720,McDonald's,37.4718736,-122.1402374,"2401 University Ave, East Palo Alto","['2401, University Avenue, Ravenswood, East Palo Alto, San Mateo County, California, 94303, United States']"
721,McDonald's,37.649021,-122.065915,"26253 Mission Blvd, Hayward","['26253, Mission Boulevard, Sorenson, Hayward, Alameda County, California, 94544, United States']"
722,McDonald's,37.5249432,-122.2818365,"522 El Camino Real, Belmont","['El Camino Real, Belmont, San Mateo County, California, 94002, United States']"
723,McDonald's,37.5944191,-122.50214,"576 Linda Mar Blvd, Pacifica","['576, Linda Mar Boulevard, Pedro Valley, Pacifica, San Mateo County, California, 94044, United States']"
724,McDonald's,37.6672466,-122.0811819,"23989 Watkins St, Hayward","['23989, Watkins Street, Hayward, Alameda County, California, 94544, United States']"
725,McDonald's,37.4676047,-122.2236512,"709 Woodside Rd, Redwood City","['709, Woodside Road, Redwood City, San Mateo County, California, 94061, United States']"
726,McDonald's,37.5257071,-122.0055449,"3000 Newpark Mall Rd, Newark",['NaN']
727,McDonald's,37.5495472,-122.0464486,"35192 Newark Blvd, Newark","['35192 Newark Boulevard, Newark Boulevard, Newark, Alameda County, California, 94555, United States']"
728,McDonald's,37.5395549,-121.9231343,"42800 Mission Blvd, Fremont","['42800, Mission Boulevard, Mission San Jose District, Fremont, Alameda County, California, 94539, United States']"
729,McDonald's,37.4574055,-121.9109749,"1854 N Milpitas Blvd, Milpitas","[""McDonald's, 1854, North Milpitas Boulevard, Milpitas, Santa Clara County, California, 95035, United States""]"
730,McDonald's,35.1062861,-114.5976382,"2250 AZ-95, Bullhead City","[""McDonald's, 2250, Mohave Valley Highway, Bullhead City, Mohave County, Arizona, 86442, United States""]"
731,McDonald's,34.4708083,-114.3432757,"100 Swanson Ave, Lake Havasu City","['Swanson Avenue, Lake Havasu City, Mohave County, Arizona, 86403-0965, United States']"
732,McDonald's,35.1636854,-114.5719387,"1900 S Casino Dr, Laughlin","['Outback Steakhouse, 1900, South Casino Drive, Laughlin, Clark County, Nevada, 89029, United States']"
733,McDonald's,34.5733393,-114.365599,"6501 Showplace Ave, Lake Havasu City",['NaN']
734,McDonald's,34.8393924,-114.6100643,"1201 3rd St, Needles","['1201, 3rd Street, Needles, San Bernardino County, California, 92363, United States']"
735,McDonald's,35.0182407,-114.5974889,"1511 E Aztec Dr, Fort Mohave",['NaN']
736,McDonald's,35.169463,-114.5654721,"600 Highway 95, Bullhead City","['600, Mohave Valley Highway, Bullhead City, Mohave County, Arizona, 86429, United States']"
737,McDonald's,35.0824839,-114.594178,"2840 Hwy 95 Wm#1370, Bullhead City",['NaN']
738,McDonald's,37.739311,-121.421765,"236 E 11th St, Tracy","['11th Street, Tracy City, Grundy County, Tennessee, 37387, United States']"
739,McDonald's,34.0630071,-118.0638668,"9437 Garvey Ave, South El Monte","['9437, Garvey Avenue, El Monte, Los Angeles County, California, 91733, United States']"
740,McDonald's,33.6432415,-117.5957385,"30672 Santa Margarita Pkwy, Rancho Santa Margarita","[""McDonald's, 30672, Santa Margarita Parkway, Rancho Santa Margarita, Orange County, California, 92688, United States""]"
741,McDonald's,33.627787,-117.7162273,"23742 Rockfield Blvd, Lake Forest","[""McDonald's, 23742, Rockfield Boulevard, Lake Forest, Orange County, California, 92630, United States""]"
742,McDonald's,34.1471877,-118.7601806,"29161 Canwood St, Agoura Hills","[""McDonald's, 29161, Canwood Street, Malibu Junction, Agoura Hills, Los Angeles County, California, 91301, United States""]"
743,McDonald's,34.2005512,-118.8678512,"1730 N Moorpark Rd, Thousand Oaks","['1730, North Moorpark Road, Thousand Oaks, Ventura County, California, 91360, United States']"
744,McDonald's,34.272273,-118.770419,"1495 E Los Angeles Ave, Simi Valley","['1495, East Los Angeles Avenue, Simi Valley, Ventura County, California, 93063, United States']"
745,McDonald's,34.2824963,-118.6798337,"2605 Yosemite Ave, Simi Valley","['2605, Yosemite Avenue, Montaire, Simi Valley, Ventura County, California, 93063, United States']"
746,McDonald's,33.9945237,-117.0573078,"1199 Calimesa Blvd, Calimesa","['1199, Calimesa Boulevard, Calimesa, Riverside County, California, 92320, United States']"
747,McDonald's,34.1862303,-118.3708552,"11000 Victory Blvd, North Hollywood","['Victory Boulevard, North Hollywood, Los Angeles, Los Angeles County, California, 91601, United States']"
748,McDonald's,34.186434,-118.45709,"14850 Victory Blvd, Van Nuys","['14850, Victory Boulevard, Van Nuys, Los Angeles, Los Angeles County, California, 91411, United States']"
749,McDonald's,34.2007886,-118.4315845,"13700 Sherman Way, Van Nuys","['13700, Sherman Way, Van Nuys, Los Angeles, Los Angeles County, California, 91405, United States']"
750,McDonald's,34.19898,-118.18761,"449 Foothill Blvd, La Cañada Flintridge","['449, Foothill Boulevard, La Cañada Flintridge, Los Angeles County, California, 91011, United States']"
751,McDonald's,38.5246063,-121.4098091,"8020 Fruitridge Rd, Sacramento","['8020, Fruitridge Road, Sacramento, Sacramento County, California, 95820, United States']"
752,McDonald's,36.297668,-119.156229,"1109 W Visalia Rd, Exeter","['West Visalia Road, Exeter, Tulare County, California, 93221, United States']"
753,McDonald's,36.2029516,-119.1030642,"208 CA-65, Lindsay","['208, CA 65, Lindsay, Tulare County, California, 93247, United States']"
754,McDonald's,36.0798981,-119.0472742,"1355 W Henderson Ave, Porterville","['1355, West Henderson Avenue, Porterville, Tulare County, California, 93257, United States']"
755,McDonald's,33.3714913,-117.2521079,"143 Ammunition Rd, Fallbrook","[""McDonald's, 143, Ammunition Road, Fallbrook, San Diego County, California, 92028, United States""]"
756,McDonald's,33.7471503,-116.9526385,"1855 E Florida Ave, East Hemet",['NaN']
757,McDonald's,34.0036566,-117.8889696,"2623 Valley Blvd, West Covina","['Valley Boulevard, City of Industry, West Covina, Los Angeles County, California, 91789, United States']"
758,McDonald's,35.6242233,-117.6692766,"150 N China Lake Blvd, Ridgecrest","['150, North China Lake Boulevard, Ridgecrest, Kern County, California, 93555, United States']"
759,McDonald's,37.7062031,-121.9243333,"7145 Dublin Blvd, Dublin","[""McDonald's, 7145, Dublin Boulevard, Dublin, Alameda County, California, 94588, United States""]"
760,McDonald's,37.9838452,-122.3187178,"3350 Klose Way, Richmond","['3350, Klose Way, Hilltop Plaza, Richmond, Contra Costa County, California, 94806, United States']"
761,McDonald's,33.6707731,-117.7893912,"5445 Alton Pkwy, Irvine","['5445, Alton Parkway, Woodbridge, Irvine, Orange County, California, 92604, United States']"
762,McDonald's,33.874303,-117.997819,"5900 Beach Blvd, Buena Park","['5900, Beach Boulevard, Buena Park, Orange County, California, 90621, United States']"
763,McDonald's,34.1990708,-119.1954337,"401 Ventura Ave, Oxnard","['Oxnard Full Gospel Church, South Roosevelt Avenue, Oxnard, Ventura County, California, 93031, United States']"
764,McDonald's,37.4126653,-121.8977514,"1249 Great Mall Dr, Milpitas","['Chevron, 1249, Great Mall Drive, Great Mall, Milpitas, Santa Clara County, California, 95035, United States']"
765,McDonald's,37.3047613,-121.862897,"2191 Monterey Rd, San Jose","[""McDonald's, 2191, Monterey Road, Spartan Keyes, San Jose, Santa Clara County, California, 95125, United States""]"
766,McDonald's,37.3872927,-121.8605802,"1142 N Capitol Ave, San Jose","[""McDonald's, 1142, North Capitol Avenue, Berryessa, San Jose, Santa Clara County, California, 95132, United States""]"
767,McDonald's,34.2358961,-118.5365085,"9101 Reseda Blvd, Northridge","['9101, Reseda Boulevard, Northridge, Los Angeles, Los Angeles County, California, 91324, United States']"
768,McDonald's,34.2206541,-118.5189548,"17700 W Roscoe Blvd, Northridge",['NaN']
769,McDonald's,34.2006324,-118.6105703,"22200 Sherman Way, Canoga Park","['22200, Sherman Way, Canoga Park, Los Angeles, Los Angeles County, California, 91303, United States']"
770,McDonald's,38.1067106,-122.5699261,"7340 Redwood Hwy, Novato","['Redwood Highway, Novato, Marin County, California, 94945, United States']"
771,McDonald's,37.479261,-122.224261,"185 Chestnut St, Redwood City","[""McDonald's, 185, Chestnut Street, Redwood Junction, Redwood City, San Mateo County, California, 94063, United States""]"
772,McDonald's,37.4539152,-122.1831901,"1100 El Camino Real, Menlo Park","[""McDonald's, 1100, El Camino Real, Menlo Park, San Mateo County, California, 94025, United States""]"
773,McDonald's,38.91243,-120.003284,"1035 Emerald Bay Rd, South Lake Tahoe","['Emerald Bay Road, Tahoe Valley, South Lake Tahoe, El Dorado County, California, 96158, United States']"
774,McDonald's,38.9499528,-119.9551604,"3715 Lake Tahoe Blvd, South Lake Tahoe","['Lake Tahoe Boulevard, Tahoe Valley, South Lake Tahoe, El Dorado County, California, 96158, United States']"
775,McDonald's,39.1308601,-119.7696032,"3905 S Carson St, Carson City","[""McDonald's, 3905, South Carson Street, Carson City, Nevada, 89701, United States""]"
776,McDonald's,39.1795618,-119.7664206,"2001 N Carson St, Carson City","[""McDonald's, 2001, North Carson Street, Carson City, Nevada, 89706, United States""]"
777,McDonald's,38.961664,-119.778595,"908 Santa Anita Ave, Minden",['NaN']
778,McDonald's,39.2683222,-119.577175,"3 Dayton Village Pkwy, Dayton","['3, Dayton Village Parkway, Dayton, Lyon County, Nevada, 89403, United States']"
779,McDonald's,37.6698207,-121.8582467,"3001 Bernal Ave, Pleasanton","[""McDonald's, 3001, Bernal Avenue, Pleasanton, Alameda County, California, 94566, United States""]"
780,McDonald's,40.4052543,-120.6330474,"3000 Main St, Susanville","['Main Street, Susanville, Lassen County, California, 96130, United States']"
781,McDonald's,35.3547102,-118.9147684,"356 Weedpatch Hwy, Bakersfield","[""McDonald's, 356, Weedpatch Highway, City of Bakersfield, Kern County, California, 93307, United States""]"
782,McDonald's,35.397215,-118.96719,"2699 Mount Vernon Ave, Bakersfield","['2699, Mount Vernon Avenue, Bakersfield, Kern County, California, 93306, United States']"
783,McDonald's,35.261419,-118.914839,"10320 Main St, Lamont","['Main Street, Lamont, Buchanan County, Iowa, 50650, United States']"
784,McDonald's,34.7939621,-118.8524701,"49714 Gorman School Rd, Gorman","[""McDonald's, 49714, Gorman School Road, Gorman, Los Angeles County, California, 93243, United States""]"
785,McDonald's,33.8799378,-117.6145126,"808 Serfas Club Dr, Corona","[""McDonald's, 808, Serfas Club Drive, Coronita, Corona, Riverside County, California, 92882, United States""]"
786,McDonald's,33.8976546,-117.5618729,"150 Hidden Valley Pkwy, Norco","['150, Hidden Valley Parkway, Norco, Riverside County, California, 92860, United States']"
787,McDonald's,33.9392056,-117.5546985,"1511 Sixth St, Norco",['NaN']
788,McDonald's,37.6962296,-121.9288156,"1004 Stoneridge Mall Rd, Pleasanton","[""McDonald's, 1004, Stoneridge Mall Road, Pleasanton, Alameda County, California, 94588, United States""]"
