,MDName,Latitude,Longitude,Address,Full Address,Zip Code
325,McDonald's,38.249049,-122.0670435,"699 Beck Ave, Fairfield","['699, Beck Avenue, Fairfield, Solano County, California, 94533, United States']",94533
326,McDonald's,38.2692106,-122.0337483,"2212 N Texas St, Fairfield","['2212, North Texas Street, Fairfield, Solano County, California, 94533, United States']",94533
327,McDonald's,38.2494674,-122.6271654,"103 S McDowell Blvd, Petaluma","['103, South McDowell Boulevard, Petaluma, Sonoma County, California, 94954, United States']",94954
328,McDonald's,38.457976,-122.673471,"50 Mission Cir, Santa Rosa","['50, Mission Circle, Santa Rosa, Sonoma County, California, 95409, United States']",95409
329,McDonald's,38.2356637,-122.6229995,"981 Lakeville Hwy, Petaluma","['Lakeville Highway, McNear, Petaluma, Sonoma County, California, 94952, United States']",94952
330,McDonald's,38.5476053,-122.8114884,"125 Windsor River Rd, Windsor","['125, Windsor River Road, Windsor, Sonoma County, California, 95492, United States']",95492
331,McDonald's,38.452911,-122.71688,"1264 Mendocino Ave, Santa Rosa","[""McDonald's, 1264, Mendocino Avenue, Santa Rosa, Sonoma County, California, 95402, United States""]",95402
332,McDonald's,38.6055233,-122.8684099,"110 Healdsburg Ave, Healdsburg","['110, Healdsburg Avenue, Healdsburg, Sonoma County, California, 95448, United States']",95448
333,McDonald's,38.344415,-122.711631,"6600 Commerce Blvd, Rohnert Park","['6600, Commerce Boulevard, Rohnert Park, Sonoma County, California, 94926, United States']",94926
334,McDonald's,38.2588229,-122.0673794,"3080 Travis Blvd, Fairfield","['3080, Travis Boulevard, Fairfield, Solano County, California, 94534, United States']",94534
335,McDonald's,38.4529283,-122.7705237,"2521 Guerneville Rd, Santa Rosa","['2521, Guerneville Road, Santa Rosa, Sonoma County, California, 95401, United States']",95401
336,McDonald's,34.1960317,-119.1603107,"605 S Rose Ave, Oxnard","['605, South Rose Avenue, Oxnard, Ventura County, California, 93030, United States']",93030
337,McDonald's,34.2014569,-118.5423343,"18761 Sherman Way, Reseda","['18761, Sherman Way, Reseda, Los Angeles, Los Angeles County, California, 91335, United States']",91335
338,McDonald's,34.2332861,-119.172805,"110 Riverpark Blvd, Oxnard","['110, Riverpark Boulevard, El Rio, Oxnard, Ventura County, California, 93036, United States']",93036
339,McDonald's,34.2588235,-118.5356475,"10350 Reseda Blvd, Northridge","[""McDonald's, 10350, Reseda Boulevard, Northridge, Los Angeles, Los Angeles County, California, 91324-2036, United States""]",91324-2036
340,McDonald's,34.217213,-119.177873,"1711 N Oxnard Blvd, Oxnard","['North Oxnard Boulevard, Riverpark, Oxnard, Ventura County, California, 93036, United States']",93036
341,McDonald's,34.2793635,-118.8743153,"501 New Los Angeles Ave, Moorpark","['501, New Los Angeles Avenue, Virginia Colony, Moorpark, Ventura County, California, 93021, United States']",93021
342,McDonald's,34.012092,-118.494355,"1540 2nd St, Santa Monica","['1540, 2nd Street, Santa Monica, Los Angeles County, California, 90401, United States']",90401
343,McDonald's,34.2223622,-119.158899,"2201 N Rose Ave, Oxnard","['2201, North Rose Avenue, Oxnard, Ventura County, California, 93036, United States']",93036
344,McDonald's,34.4231703,-118.563033,"27103 McBean Pkwy, Santa Clarita","['27103, McBean Parkway, Santa Clarita, Los Angeles County, California, 91354, United States']",91354
345,McDonald's,34.4461111,-118.5530556,"27776 McBean Pkwy, Valencia","['McBean Parkway, Valencia, Santa Clarita, Los Angeles County, California, 91355, United States']",91355
346,McDonald's,34.183338,-118.604401,"21901 Erwin St, Los Angeles","['21901, Erwin Street, Warner Center, Los Angeles, Los Angeles County, California, 91367, United States']",91367
347,McDonald's,34.1762851,-119.2090021,"401 W Channel Islands Blvd, Port Hueneme","['401, West Channel Islands Boulevard, Oxnard, Port Hueneme, Ventura County, California, 93041, United States']",93041
348,McDonald's,34.228637,-118.5545218,"19315 Parthenia St, Northridge","['19315, Parthenia Street, Northridge, Los Angeles, Los Angeles County, California, 91324, United States']",91324
349,McDonald's,34.193435,-118.587893,"6750 De Soto Ave, Canoga Park","['6750, De Soto Avenue, Canoga Park, Los Angeles, Los Angeles County, California, 91303, United States']",91303
351,McDonald's,34.2665047,-119.272331,"2137 E Harbor Blvd, Ventura","['2137, East Harbor Boulevard, Pierpont Bay, Ventura, Ventura County, California, 93001, United States']",93001
353,McDonald's,34.2107219,-118.8434887,"1908 E Avenida De Los Arboles, Thousand Oaks","['1908, East Avenida de Los Arboles, Thousand Oaks, Ventura County, California, 91362, United States']",91362
354,McDonald's,34.1880986,-118.9406137,"850 Wendy Dr, Newbury Park","['North Wendy Drive, Casa Conejo, Thousand Oaks, Ventura County, California, 91320, United States']",91320
355,McDonald's,37.6480253,-122.4296102,"587 El Camino Real, South San Francisco","['587, El Camino Real, Baden, South San Francisco, San Mateo County, California, 94080, United States']",94080
356,McDonald's,37.6439805,-122.4036431,"381 S Airport Blvd, South San Francisco","['381, South Airport Boulevard, South San Francisco, San Mateo County, California, 94080, United States']",94080
357,McDonald's,37.6521951,-122.4912675,"125 Monterey Rd, Pacifica","[""McDonald's, 125, Monterey Road, Edgemar, Pacifica, San Mateo County, California, 94044, United States""]",94044
358,McDonald's,37.6688974,-122.4699976,"505 Serramonte Blvd, Daly City","[""McDonald's, 505, Serramonte Boulevard, Daly City, San Mateo County, California, 94015, United States""]",94015
359,McDonald's,37.707845,-122.132916,"14823 E 14th St, San Leandro","['14823, East 14th Street, San Leandro, Alameda County, California, 94578, United States']",94578
360,McDonald's,37.6065481,-122.3984272,"1101 El Camino Real, Millbrae","[""McDonald's, 1101, El Camino Real, Millbrae, San Mateo County, California, 94030, United States""]",94030
361,McDonald's,37.689144,-122.063058,"2905 Grove Way, Castro Valley","['2905, Grove Way, Castro Valley, Alameda County, California, 94546, United States']",94546
362,McDonald's,37.6314189,-122.0965272,"2299 W Tennyson Rd, Hayward","['2299, West Tennyson Road, Hayward, Alameda County, California, 94545, United States']",94545
363,McDonald's,37.6667562,-122.1061733,"355 W A St, Hayward","[""McDonald's, 355, West A Street, Hayward, Alameda County, California, 94541, United States""]",94541
364,McDonald's,37.6921026,-122.0897166,"1620 Strobridge Ave, Castro Valley","['1620, Strobridge Avenue, Castro Valley, Alameda County, California, 94546, United States']",94546
365,McDonald's,37.6437801,-122.4537025,"2298 Gellert Blvd, South San Francisco","['2298, Gellert Boulevard, Westborough, South San Francisco, San Mateo County, California, 94080, United States']",94080
366,McDonald's,37.7245775,-121.9432291,"21001 San Ramon Valley Blvd, San Ramon","['Starbucks, 21001, San Ramon Valley Boulevard, San Ramon, Contra Costa County, California, 94583, United States']",94583
367,McDonald's,37.5343206,-121.9667494,"40708 Grimmer Blvd, Fremont","[""McDonald's, 40708, Grimmer Boulevard, Irvington District, Fremont, Alameda County, California, 94538, United States""]",94538
368,McDonald's,34.112794,-117.762017,"2269 Foothill Blvd, La Verne","[""McDonald's, 2269, Foothill Boulevard, La Verne, Los Angeles County, California, 91750, United States""]",91750
370,McDonald's,33.8889615,-117.8105401,"18515 Yorba Linda Blvd, Yorba Linda","[""McDonald's, 18515, Yorba Linda Boulevard, Yorba Linda, Orange County, California, 92886, United States""]",92886
371,McDonald's,33.6527935,-117.6469727,"27700 Santa Margarita Pkwy, Mission Viejo","[""McDonald's, 27700, Santa Margarita Parkway, Mission Viejo, Orange County, California, 92691, United States""]",92691
372,McDonald's,34.0238797,-117.6889255,"12625 Central Ave, Chino","['12625, Central Avenue, Chino, San Bernardino County, California, 91710, United States']",91710
373,McDonald's,34.121191,-117.6155788,"8701 Base Line Rd, Rancho Cucamonga","['8701, Base Line Road, Alta Loma, Rancho Cucamonga, San Bernardino County, California, 91730, United States']",91730
374,McDonald's,33.6806754,-117.6653954,"26692 Portola Pkwy, Foothill Ranch","[""McDonald's, 26692, Portola Parkway, Foothill Ranch, Lake Forest, Orange County, California, 92610, United States""]",92610
375,McDonald's,37.33723,-122.0410278,"10990 N Stelling Rd, Cupertino","[""McDonald's, 10990, North Stelling Road, Cupertino, Santa Clara County, California, 95014-0353, United States""]",95014-0353
376,McDonald's,37.3934387,-122.0289637,"696 N Mathilda Ave, Sunnyvale","[""McDonald's, 696, North Mathilda Avenue, Sunnyvale, Santa Clara County, California, 94085, United States""]",94085
377,McDonald's,37.3832213,-121.8955898,"1702 Old Oakland Rd, San Jose","[""McDonald's, 1702, Oakland Road, Wayne, San Jose, Santa Clara County, California, 95131, United States""]",95131
378,McDonald's,37.3629441,-122.0272066,"556 E El Camino Real, Sunnyvale","['556, East El Camino Real, Sunnyvale, Santa Clara County, California, 94087, United States']",94087
379,McDonald's,37.4194009,-122.0936501,"1060 Rengstorff Ave, Mountain View","['Rengstorff Avenue, Mountain View, Santa Clara County, California, 94043, United States']",94043
380,McDonald's,37.3486531,-121.8650277,"1299 E Santa Clara St, San Jose","[""McDonald's, 1299, East Santa Clara Street, Little Portugal, San Jose, Santa Clara County, California, 95116, United States""]",95116
381,McDonald's,37.3854773,-121.995403,"550 Lawrence Expy, Sunnyvale","[""McDonald's, 550, Lawrence Expressway, Sunnyvale, Santa Clara County, California, 94088-3453, United States""]",94088-3453
382,McDonald's,37.3232338,-121.9133044,"1398 W San Carlos St, San Jose","['McDonalds, 1398, West San Carlos Street, Buena Vista, San Jose, Santa Clara County, California, 95126, United States']",95126
383,McDonald's,37.4178054,-121.8715766,"1795 Landess Ave, Milpitas","[""McDonald's, 1795, Landess Avenue, Milpitas, Santa Clara County, California, 95035, United States""]",95035
384,McDonald's,37.3670152,-121.8484982,"2353 McKee Rd, San Jose","[""McDonald's, 2353, McKee Road, San Jose, Santa Clara County, California, 95116, United States""]",95116
385,McDonald's,37.2899339,-121.8806531,"2434 Almaden Rd, San Jose","['McDonalds, 2434, Almaden Road, San Jose, Santa Clara County, California, 95125, United States']",95125
386,McDonald's,37.3309324,-121.8603368,"777 Story Rd, San Jose","['Walmart Supercenter, 777, Story Road, Little Saigon, San Jose, Santa Clara County, California, 95122, United States']",95122
387,McDonald's,37.2999234,-121.8224553,"1033 E Capitol Expy, San Jose","['McDonalds, 1033, East Capitol Expressway, San Jose, Santa Clara County, California, 95121, United States']",95121
388,McDonald's,37.303899,-122.031826,"1150 S De Anza Blvd, San Jose","[""McDonald's, 1150, South De Anza Boulevard, San Jose, Santa Clara County, California, 95129, United States""]",95129
389,McDonald's,37.3047613,-121.862897,"2191 Monterey Rd, San Jose","[""McDonald's, 2191, Monterey Road, Spartan Keyes, San Jose, Santa Clara County, California, 95125, United States""]",95125
390,McDonald's,37.2728494,-121.9335242,"2699 Union Ave, San Jose","[""McDonald's, 2699, Union Avenue, San Jose, Santa Clara County, California, 95124, United States""]",95124
391,McDonald's,37.4211531,-122.1395662,"3128 El Camino Real, Palo Alto","['El Camino Real, Palo Alto, Santa Clara County, California, 94301, United States']",94301
392,McDonald's,37.3236817,-121.9690762,"3895 Stevens Creek Blvd, Santa Clara","['3895, Stevens Creek Boulevard, Santa Clara, Santa Clara County, California, 95117, United States']",95117
393,McDonald's,37.3248198,-121.8231071,"1935 Tully Rd, San Jose","['1935, Tully Road, San Jose, Santa Clara County, California, 95122, United States']",95122
394,McDonald's,37.3498252,-121.82767,"2680 Story Rd, San Jose","[""McDonald's, 2680, Story Road, San Jose, Santa Clara County, California, 95122, United States""]",95122
395,McDonald's,32.950007,-117.107686,"12808 Rancho Penasquitos Blvd, San Diego","[""McDonald's, 12808, Rancho Peasquitos Boulevard, San Diego, San Diego County, California, 92129-2935, United States""]",92129-2935
396,McDonald's,32.753742,-117.218471,"3805 Midway Dr, San Diego","['3805, Midway Drive, San Diego, San Diego County, California, 92110, United States']",92110
397,McDonald's,33.596672,-117.676202,"25192 Cabot Rd, Laguna Hills","[""McDonald's, 25192, Cabot Road, Laguna Hills, Orange County, California, 92653, United States""]",92653
398,McDonald's,32.8068945,-117.2188237,"4711 Mission Bay Dr, San Diego","[""McDonald's, 4711, Mission Bay Drive, San Diego, San Diego County, California, 92109, United States""]",92109
399,McDonald's,33.013246,-117.078605,"16440 Bernardo Center Dr, San Diego","[""McDonald's, 16440, Bernardo Center Drive, Rancho Bernardo, San Diego, San Diego County, California, 92128, United States""]",92128
400,McDonald's,33.5233874,-117.6861906,"30305 Street Of The, Golden Lantern, Laguna Niguel","['Niguel Point Properties, Inc., 30251, Golden Lantern Street, Laguna Niguel, Orange County, California, 92677, United States']",92677
401,McDonald's,33.46528,-117.689822,"34277 CA-1, Dana Point","[""McDonald's, 34277, Pacific Coast Highway, Dana Point, Orange County, California, 92629, United States""]",92629
402,McDonald's,32.7186937,-117.1540936,"1280 Park Blvd, San Diego","[""1280, Park Boulevard, Core District, Banker's Hill, San Diego, San Diego County, California, 92101, United States""]",92101
403,McDonald's,32.8668212,-117.2153675,"4260 Nobel Dr, San Diego","['4260, Nobel Drive, University City, San Diego, San Diego County, California, 92122, United States']",92122
404,McDonald's,33.1482526,-117.199721,"120 S Rancho Santa Fe Rd, San Marcos","[""McDonald's, 120, South Rancho Santa Fe Road, San Marcos, San Diego County, California, 92069, United States""]",92069
405,McDonald's,32.8206588,-117.178022,"5920 Balboa Ave, San Diego","[""McDonald's, 5920, Balboa Avenue, Clairemont, San Diego, San Diego County, California, 92111, United States""]",92111
406,McDonald's,32.7488403,-117.150758,"1414 University Ave, San Diego","['1414, University Avenue, Hillcrest, San Diego, San Diego County, California, 92103, United States']",92103
407,McDonald's,32.7976126,-117.2495028,"1121 Garnet Ave, San Diego","['1121, Garnet Avenue, Pacific Beach, San Diego, San Diego County, California, 92109, United States']",92109
408,McDonald's,32.9819335,-117.0763226,"11915 Carmel Mountain Rd, San Diego","[""McDonald's, 11915, Carmel Mountain Road, Carmel Mountain Ranch, San Diego, San Diego County, California, 92128, United States""]",92128
409,McDonald's,32.833168,-117.201912,"5065 Clairemont Dr, San Diego","[""McDonald's, 5065, Clairemont Drive, North Clairemont, San Diego, San Diego County, California, 92117, United States""]",92117
410,McDonald's,33.566055,-117.708255,"27331 La Paz Rd, Laguna Niguel","['27331, La Paz Road, Laguna Niguel, Orange County, California, 92677, United States']",92677
411,McDonald's,32.8019176,-117.0117189,"8770 Lake Murray Blvd, San Diego","['8770, Lake Murray Boulevard, San Diego, San Diego County, California, 92119, United States']",92119
412,McDonald's,33.439496,-117.6201906,"650 Avenida Pico, San Clemente","[""McDonald's, 650, Avenida Pico, San Clemente, Orange County, California, 92673, United States""]",92673
413,McDonald's,32.727951,-117.2267667,"1624 Rosecrans St, San Diego","['1624, Rosecrans Street, Roseville, San Diego, San Diego County, California, 92106, United States']",92106
414,McDonald's,33.1226277,-117.3242339,"5990 Avenida Encinas, Carlsbad","[""McDonald's, 5990, Avenida Encinas, Farr, Carlsbad, San Diego County, California, 92008, United States""]",92008
416,McDonald's,36.5997527,-121.8880687,"610 Del Monte Ave, Monterey","['610, Del Monte Avenue, Monterey, Monterey County, California, 93940, United States']",93940
417,McDonald's,36.6190131,-121.844092,"990 Playa Ave, Sand City","['990, Playa Avenue, Sand City, Monterey County, California, 93955, United States']",93955
418,McDonald's,36.983059,-122.022357,"1210 Ocean St, Santa Cruz","['1210, Ocean Street, Ocean Street Commercial Corridor, Downtown, Santa Cruz, Santa Cruz County, California, 95060, United States']",95060
419,McDonald's,36.7046821,-121.6534639,"1365 N Main St, Salinas","['1365, North Main Street, Salinas, Monterey County, California, 93906, United States']",93906
420,McDonald's,36.9753076,-121.9637216,"1760 41st Ave, Capitola","[""McDonald's, 1760, 41st Avenue, Capitola, Santa Cruz County, California, 95010, United States""]",95010
421,McDonald's,36.685562,-121.794569,"267 Reservation Rd, Marina","[""McDonald's, 267, Reservation Road, Marina, Monterey County, California, 93933, United States""]",93933
422,McDonald's,36.7924016,-121.6663367,"17537 Vierra Canyon Rd, Salinas","[""McDonald's, 17537, Vierra Canyon Road, Rollin J. Vierra Tract, Salinas, Monterey County, California, 93907, United States""]",93907
423,McDonald's,36.6567541,-121.6595359,"1213 S Main St, Salinas","['1213, South Main Street, Salinas, Monterey County, California, 93901, United States']",93901
424,McDonald's,36.9076277,-121.7536131,"190 Main St, Watsonville","[""McDonald's, 190, Main Street, Watsonville, Santa Cruz County, California, 95076, United States""]",95076
425,McDonald's,36.6803314,-121.6410139,"155 Kern St, Salinas","['155, Kern Street, Salinas, Monterey County, California, 93905, United States']",93905
426,McDonald's,36.7153144,-121.626007,"600 E Boronda Rd, Salinas","['600, East Boronda Road, Santa Rita, Salinas, Monterey County, California, 93906, United States']",93906
427,McDonald's,36.6727885,-121.6293349,"840 E Alisal St, Salinas","['840, East Alisal Street, Salinas, Monterey County, California, 93905, United States']",93905
428,McDonald's,36.9167973,-121.7757332,"1459 Main St, Watsonville","['1459, Main Street, Watsonville, Santa Cruz County, California, 95076, United States']",95076
429,McDonald's,36.9321618,-121.7696453,"1598 Freedom Blvd, Watsonville","['1598, Freedom Boulevard, Watsonville, Santa Cruz County, California, 95076, United States']",95076
430,McDonald's,36.6083173,-121.856052,"1516 Canyon Del Rey Blvd, Seaside","['1516, Canyon del Rey Boulevard, Del Monte, Seaside, Monterey County, California, 93955, United States']",93955
431,McDonald's,37.0016155,-121.5599683,"6990 Automall Pkwy, Gilroy","['6990, Automall Parkway, Gilroy, Santa Clara County, California, 95020, United States']",95020
432,McDonald's,36.6800873,-121.6056544,"608 Williams Rd, Salinas","['608, Williams Road, Salinas, Monterey County, California, 93905, United States']",93905
433,McDonald's,36.8370658,-121.3891251,"1711 Airline Hwy, Hollister","['Airline Highway, Hollister, San Benito County, California, 95023-7612, United States']",95023-7612
434,McDonald's,36.5140643,-121.4371211,"805 5th St, Gonzales","['805, 5th Street, Gonzales, Monterey County, California, 93926, United States']",93926
435,McDonald's,34.2625738,-119.2370506,"4110 E Main St, Ventura","[""McDonald's, 4110, East Main Street, Ventura, Ventura County, California, 93003, United States""]",93003
436,McDonald's,34.221418,-119.070886,"60 W Daily Dr, Camarillo","['West Daily Drive, Springville, Camarillo, Ventura County, California, 93010, United States']",93010
437,McDonald's,34.2778299,-119.2136684,"5980 Telegraph Rd, Ventura","[""McDonald's, 5980, Telegraph Road, Ventura, Ventura County, California, 93003, United States""]",93003
438,McDonald's,34.2349603,-119.0385845,"1650 Arneill Rd, Camarillo","['Arneill Road, Old Town, Camarillo, Ventura County, California, 93010, United States']",93010
439,McDonald's,34.396815,-119.512362,"1115 Casitas Pass Rd, Carpinteria","['1115, Casitas Pass Road, Carpinteria, Santa Barbara County, California, 93013, United States']",93013
440,McDonald's,34.1712213,-119.1771226,"3120 Saviers Rd, Oxnard","['3120, Saviers Road, Oxnard, Ventura County, California, 93033, United States']",93033
441,McDonald's,34.3464136,-119.0706671,"138 Harvard Blvd, Santa Paula","['138, East Harvard Boulevard, Santa Paula, Ventura County, California, 93060, United States']",93060
442,McDonald's,34.1805301,-119.1651526,"1741 Pacific Ave, Oxnard","['1741, Pacific Avenue, Oxnard, Ventura County, California, 93033, United States']",93033
443,McDonald's,33.740348,-116.216082,"42550 Jackson St, Indio","['Panda Express, 42550, Jackson Street, Indio, Riverside County, California, 92203, United States']",92203
444,McDonald's,34.1366053,-116.0539974,"6455 Adobe Rd, Twentynine Palms","['6455, Adobe Road, Twentynine Palms, San Bernardino County, California, 92277, United States']",92277
445,McDonald's,33.7599877,-116.2979551,"78365 Varner Rd, Palm Desert","['KEZN-FM (Palm Desert), Varner Road, Thousand Palms, Cathedral City, Riverside County, California, 92263, United States']",92263
448,McDonald's,33.8014174,-116.388617,"34101 Monterey Ave, Rancho Mirage","['34101, Monterey Avenue, Rancho Mirage, Riverside County, California, 92270, United States']",92270
449,McDonald's,33.7406911,-116.2284817,"82491 Ave 42, Indio","['Walmart Supercenter, 82491, Avenue 42, Indio, Riverside County, California, 92203, United States']",92203
450,McDonald's,33.74705,-116.9962708,"2321 W Florida Ave, Hemet","['2321, West Florida Avenue, Hemet, Riverside County, California, 92545, United States']",92545
451,McDonald's,33.7949078,-116.9711679,"611 N State St, San Jacinto","['State Street, San Jacinto, Riverside County, California, 92583, United States']",92583
452,McDonald's,33.9455539,-116.5009238,"14280 Palm Dr, Desert Hot Springs","['14280, Palm Drive, Desert Hot Springs, Riverside County, California, 92240, United States']",92240
453,McDonald's,33.8193349,-116.4587553,"31-545 Date Palm Dr, Cathedral City","['Date Palm Drive, Cathedral City, Riverside County, California, 92264-3613, United States']",92264-3613
454,McDonald's,33.8219762,-116.406551,"31250 Bob Hope Dr, Cathedral City","['Bob Hope Drive, Thousand Palms, Cathedral City, Riverside County, California, 92263, United States']",92263
455,McDonald's,33.7879976,-116.4826009,"67555 E Palm Canyon Dr, Cathedral City","['Travelodge by Wyndham Cathedral City, 67495, East Palm Canyon Drive, Cathedral City, Riverside County, California, 92234, United States']",92234
456,McDonald's,33.8008654,-116.5205708,"2465 E Palm Canyon Dr, Palm Springs","['Chipotle Mexican Grill, 2465, East Palm Canyon Drive, Palm Springs, Riverside County, California, 92264, United States']",92264
457,McDonald's,33.7296863,-116.9733553,"290 W Stetson Ave, Hemet","['290, West Stetson Avenue, Hemet, Riverside County, California, 92543, United States']",92543
458,McDonald's,33.844545,-116.526249,"1717 E Vista Chino East, Palm Springs","['1717, East Vista Chino, Palm Springs, Riverside County, California, 92262, United States']",92262
459,McDonald's,37.96682699999999,-121.295414,"1423 N Center St, Stockton","['North Center Street, Stockton, San Joaquin County, California, 95202, United States']",95202
460,McDonald's,37.81139659999999,-121.2911761,"300 E Louise Ave, Lathrop","[""McDonald's, 300, East Louise Avenue, Lathrop, San Joaquin County, California, 95330, United States""]",95330
461,McDonald's,38.023139,-121.32243,"8020 N Lower Sacramento Rd, Stockton","['8020, North Lower Sacramento Road, Stockton, San Joaquin County, California, 95210, United States']",95210
462,McDonald's,38.0216368,-121.2722493,"3355 E Hammer Ln, Stockton","[""McDonald's, 3355, East Hammer Lane, Stockton, San Joaquin County, California, 95212, United States""]",95212
463,McDonald's,37.5407599,-121.2663656,"4561 Howard Rd, Westley","['Howard Road, Westley, Stanislaus County, California, 95387, United States']",95387
464,McDonald's,37.937556,-121.295604,"611 W Charter Way, Stockton","['611, West Charter Way, Stockton, San Joaquin County, California, 95206, United States']",95206
465,McDonald's,37.7389452,-121.4505583,"1820 W 11th St, Tracy","['1820, West 11th Street, West Park, Tracy, San Joaquin County, California, 95376, United States']",95376
466,McDonald's,38.00208,-121.292205,"1049 E March Ln, Stockton","['1049, East March Lane, Akers, Stockton, San Joaquin County, California, 95210, United States']",95210
467,McDonald's,37.949392,-121.2895268,"322 S Center St, Stockton","['South Center Street, The Homestead, Stockton, San Joaquin County, California, 95206, United States']",95206
468,McDonald's,39.9048127,-122.1981315,"3375 Sunrise Way, Corning","['3375, Sunrise Way, Corning, Tehama County, California, 96021, United States']",96021
469,McDonald's,34.0330278,-118.1838249,"3868 E 3rd St, East Los Angeles","['3868, East 3rd Street, Wellington Heights, East Los Angeles, Los Angeles County, California, 90063, United States']",90063
470,McDonald's,34.1190438,-118.1928237,"5725 York Blvd, Highland Park","['5725, York Boulevard, Highland Park, Los Angeles, Los Angeles County, California, 90042, United States']",90042
472,McDonald's,34.1514229,-118.0267346,"143 E Foothill Blvd, Arcadia","['143, East Foothill Boulevard, Arcadia, Los Angeles County, California, 91006, United States']",91006
473,McDonald's,33.9256505,-118.2386774,"11800 Wilmington Ave, Los Angeles","['11800, Wilmington Avenue, Willowbrook, Carson, Los Angeles County, California, 90059, United States']",90059
474,McDonald's,33.928759,-118.147949,"12256 Paramount Blvd, Downey","[""McDonald's, 12256, Paramount Boulevard, Downey, Los Angeles County, California, 90242, United States""]",90242
475,McDonald's,34.07057220000001,-118.2682112,"405 N Alvarado St, Los Angeles","['Alvarado Street, Westlake, Los Angeles, Los Angeles County, California, 90006-5010, United States']",90006-5010
476,McDonald's,36.765596,-119.73605,"4803 E McKinley Ave, Fresno","['4803, East McKinley Avenue, Fresno, Fresno County, California, 93703, United States']",93703
