,MDName,Latitude,Longitude,Address,Full Address,Zip Code
477,McDonald's,36.792936,-119.699592,"5608 E Ashlan Ave, Fresno","[""McDonald's, 5608, East Ashlan Avenue, Tarpey Village, Fresno County, California, 93727, United States""]",93727
478,McDonald's,36.8516427,-119.7730235,"669 E Nees Ave, Fresno","['669, East Nees Avenue, Fresno, Fresno County, California, 93720, United States']",93720
479,McDonald's,36.735556,-119.732212,"4898 E Kings Canyon Rd, Fresno","[""McDonald's, 4898, East Kings Canyon Road, Fresno, Fresno County, California, 93727, United States""]",93727
480,McDonald's,36.7361802,-119.7493977,"4505 E Kings Canyon Rd, Fresno","['4505, East Kings Canyon Road, Fresno, Fresno County, California, 93702, United States']",93702
481,McDonald's,36.835826,-119.9129176,"6741 N Riverside Dr, Fresno","['North Riverside Drive, Herndon, Fresno, Fresno County, California, 93722, United States']",93722
482,McDonald's,36.95255849999999,-120.075623,"1500 Howard Rd, Madera","['1500, Howard Road, Madera, Madera County, California, 93637, United States']",93637
483,McDonald's,36.8089089,-119.7824308,"368 E Shaw Ave, Fresno","['368, East Shaw Avenue, Fresno, Fresno County, California, 93710, United States']",93710
484,McDonald's,37.3890037,-120.7376937,"381 Joseph Gallo Dr, Livingston","['Chevron, 381, Joseph Gallo Drive, Livingston, Merced County, California, 95334, United States']",95334
485,McDonald's,37.3179538,-120.5019942,"3055 Loughborough Dr, Merced","['Walmart, 3055, Loughborough Drive, Merced, Merced County, California, 95348, United States']",95348
486,McDonald's,36.7789048,-119.7908787,"3115 N Blackstone Ave, Fresno","['3115, North Blackstone Avenue, Fresno, Fresno County, California, 93703, United States']",93703
487,McDonald's,36.8077998,-119.8498636,"3237 W Shaw Ave, Fresno","['3237, West Shaw Avenue, Fresno, Fresno County, California, 93711, United States']",93711
488,McDonald's,36.7864571,-119.7554793,"4176 E Dakota Ave, Fresno","['4176, East Dakota Avenue, Fresno, Fresno County, California, 93726, United States']",93726
489,McDonald's,36.808925,-119.718771,"417 W Shaw Ave, Clovis","['417, West Shaw Avenue, Clovis, Fresno County, California, 93612, United States']",93612
490,McDonald's,36.82044700000001,-119.789949,"5666 N Blackstone Ave, Fresno","['5666, North Blackstone Avenue, Fresno, Fresno County, California, 93710, United States']",93710
491,McDonald's,36.743533,-119.789776,"1739 Divisadero St, Fresno","['1739, Divisadero Street, Fresno, Fresno County, California, 93701, United States']",93701
492,McDonald's,33.0455865,-117.261495,"1271 Encinitas Blvd, Encinitas","['1271, Encinitas Boulevard, Encinitas, San Diego County, California, 92024, United States']",92024
493,McDonald's,32.7428852,-117.0438068,"7164 Broadway, Lemon Grove","[""McDonald's, 7164, Broadway, Lemon Grove, San Diego County, California, 91945, United States""]",91945
494,McDonald's,32.915426,-117.1302953,"9035 Mira Mesa Blvd, San Diego","[""McDonald's, 9035, Mira Mesa Boulevard, Mira Mesa, San Diego, San Diego County, California, 92126, United States""]",92126
495,McDonald's,32.693033,-117.134436,"2796 Main St, San Diego","['2796, Main Street, Otay, Chula Vista, San Diego County, California, 91911, United States']",91911
496,McDonald's,32.9526839,-117.059691,"12510 Poway Rd, Poway","['12510, Poway Road, La Paz Village, Ipai Waaypuk, Poway, San Diego County, California, 92064, United States']",92064
497,McDonald's,32.9803622,-117.249595,"2705 Via De La Valle, Del Mar","[""McDonald's, 2705, Via de la Valle, San Diego, Del Mar, San Diego County, California, 92014, United States""]",92014
498,McDonald's,32.9366902,-117.0981364,"10655 Scripps Poway Pkwy, San Diego","[""McDonald's, 10655, Scripps Poway Parkway, San Diego, San Diego County, California, 92131, United States""]",92131
499,McDonald's,38.4089116,-121.4766019,"2733 Elk Grove Blvd, Elk Grove","['Ora Dentistry, 2733, Elk Grove Boulevard, Elk Grove, Sacramento County, California, 95757, United States']",95757
500,McDonald's,38.49607710000001,-121.4844737,"2335 Florin Rd, Sacramento","['2335, Florin Road, Sacramento, Sacramento County, California, 95822, United States']",95822
501,McDonald's,38.495706,-121.4575844,"4124 Florin Rd, Sacramento","['4124, Florin Road, Parkway-South Sacramento, Parkway, Elk Grove, Sacramento County, California, 95823, United States']",95823
502,McDonald's,38.4748318,-121.4470974,"4731 Mack Rd, Sacramento","[""McDonald's, 4731, Mack Road, Sacramento, Sacramento County, California, 95823, United States""]",95823
503,McDonald's,38.4576415,-121.8416518,"1410 Ary Ln, Dixon","[""McDonald's, 1410, Ary Lane, Dixon, Solano County, California, 95620, United States""]",95620
504,McDonald's,38.5955118,-121.384694,"3412 Arden Way, Sacramento","[""McDonald's, 3412, Arden Way, Arden-Arcade, Sacramento County, California, 95825-2014, United States""]",95825-2014
505,McDonald's,33.986859,-118.185949,"5901 Atlantic Blvd, Maywood","['5901, Atlantic Boulevard, Maywood, Los Angeles County, California, 90270, United States']",90270
506,McDonald's,38.9299719,-122.6172441,"15940 Dam Rd, Clearlake","[""McDonald's, 15940, Dam Road, Clearlake, Lake County, California, 95422, United States""]",95422
507,McDonald's,39.15200530000001,-123.1986932,"115 N Orchard Ave, Ukiah","['115, North Orchard Avenue, Wagenseller, Ukiah, Mendocino County, California, 95482, United States']",95482
508,McDonald's,39.0323122,-122.9243861,"1077 Lakeport Blvd, Lakeport","['Lakeport Boulevard, Lakeport, Lake County, California, 95453, United States']",95453
509,McDonald's,38.7841043,-123.0132113,"1149 S Cloverdale Blvd, Cloverdale","['1149, South Cloverdale Boulevard, Ioli Ranch, Cloverdale, Sonoma County, California, 95425, United States']",95425
510,McDonald's,38.413534,-122.713041,"2642 Santa Rosa Ave, Santa Rosa","[""McDonald's, 2642, Santa Rosa Avenue, Santa Rosa, Sonoma County, California, 95407, United States""]",95407
511,McDonald's,39.167987,-123.211825,"1310 N State St, Ukiah","['1310, North State Street, North Ukiah, Ukiah, Mendocino County, California, 95482, United States']",95482
512,McDonald's,36.838259,-119.847943,"7035 N Marks Ave, Fresno","['7035, North Marks Avenue, Fresno, Fresno County, California, 93711, United States']",93711
513,McDonald's,36.8367094,-119.753699,"6768 N Cedar Ave, Fresno","['6768, North Cedar Avenue, Fresno, Fresno County, California, 93710, United States']",93710
514,McDonald's,36.83759149999999,-119.8024113,"7025 N Ingram Ave, Fresno","['7025, North Ingram Avenue, Fresno, Fresno County, California, 93650, United States']",93650
515,McDonald's,36.80813699999999,-119.756676,"1695 E Shaw Ave, Fresno","['1695, East Shaw Avenue, Fresno, Fresno County, California, 93710, United States']",93710
516,McDonald's,36.7377701,-119.721058,"5125 E Kings Canyon Rd, Fresno","['Walmart Supercenter, 5125, East Kings Canyon Road, Fresno, Fresno County, California, 93727, United States']",93727
517,McDonald's,36.5175056,-119.5620245,"520 Sierra St, Kingsburg","['520, Sierra Street, Kingsburg, Fresno County, California, 93631, United States']",93631
518,McDonald's,33.7000324,-116.2143374,"83131 Ave 48, Coachella","[""McDonald's, 83131, Avenue 48, Coachella, Riverside County, California, 92236, United States""]",92236
520,McDonald's,33.683868,-116.180943,"50090 Harrison St, Coachella","[""McDonald's, 50090, Cesar Chavez Street, Coachella, Riverside County, California, 92236, United States""]",92236
521,McDonald's,33.70985580000001,-116.2883198,"79-225 CA-111, La Quinta","['CA 111, La Quinta, Indian Wells, Riverside County, California, 92235, United States']",92235
522,McDonald's,38.6833951,-121.4562411,"400 Elkhorn Blvd, Rio Linda","['400, Elkhorn Boulevard, Rio Linda, Sacramento County, California, 95673, United States']",95673
523,McDonald's,38.7962371,-121.3147994,"1400 Blue Oaks Blvd, Roseville","['1400, Blue Oaks Boulevard, Roseville, Placer County, California, 95678, United States']",95678
524,McDonald's,38.6716827,-121.161728,"697 E Bidwell St, Folsom","['697, East Bidwell Street, Folsom, Sacramento County, California, 95630, United States']",95630
525,McDonald's,38.6867871,-121.3415595,"5301 Elkhorn Blvd, Sacramento","[""McDonald's, 5301, Elkhorn Boulevard, Sacramento County, California, 95842, United States""]",95842
527,McDonald's,38.7501488,-121.3098344,"3994 Foothills Blvd, Roseville","[""McDonald's, 3994, Foothills Boulevard, Roseville, Placer County, California, 95678, United States""]",95678
528,McDonald's,38.6579188,-120.9709313,"3356 Coach Ln, Cameron Park","['3356, Coach Lane, Cameron Park, El Dorado County, California, 95682, United States']",95682
529,McDonald's,38.6549007,-121.3833593,"4957 Watt Ave, North Highlands","['North Highlands Post Office, Watt Avenue, Sacramento County, California, 95652, United States']",95652
530,McDonald's,38.654845,-121.124461,"2757 E Bidwell St, Folsom","['2757, East Bidwell Street, Broadstone Plaza, Folsom, Sacramento County, California, 95630, United States']",95630
531,McDonald's,38.6649245,-121.27162,"5402 Sunrise Blvd, Citrus Heights","['5402, Sunrise Boulevard, Citrus Heights, Sacramento County, California, 95610, United States']",95610
532,McDonald's,38.6899059,-121.3834068,"6749 Watt Ave, North Highlands","['North Highlands Post Office, Watt Avenue, Sacramento County, California, 95652, United States']",95652
533,McDonald's,34.0734007,-117.9072261,"100 N Azusa Ave, West Covina","['100, North Azusa Avenue, City of Industry, West Covina, Los Angeles County, California, 91744, United States']",91744
535,McDonald's,33.8775284,-117.9619861,"1891 W Malvern Ave, Fullerton","['West Malvern Avenue, Fullerton, Orange County, California, 92832, United States']",92832
536,McDonald's,33.8894102,-118.3519399,"15606 Hawthorne Blvd, Lawndale","['15606, Hawthorne Boulevard, Lawndale, Los Angeles County, California, 90260, United States']",90260
537,McDonald's,33.9161585,-118.3473857,"4160 W El Segundo Blvd, Hawthorne","['4160, West El Segundo Boulevard, Hawthorne, Los Angeles County, California, 90250, United States']",90250
538,McDonald's,33.9157871,-118.396641,"101 S Sepulveda Blvd, El Segundo","['Pacific Coast Highway, El Segundo, Los Angeles County, California, 90245, United States']",90245
539,McDonald's,37.975928,-122.547018,"2114 4th St, San Rafael","['2114, Fourth Street, San Rafael, Marin County, California, 94901, United States']",94901
540,McDonald's,37.9960773,-122.3049525,"1402 Tara Hills Dr, Pinole","['1402, Tara Hills Drive, Pinole, Contra Costa County, California, 94564, United States']",94564
541,McDonald's,38.0087594,-122.2713096,"1570 Sycamore Ave, Hercules","['1570, Sycamore Avenue, Hercules, Contra Costa County, California, 94547, United States']",94547
542,McDonald's,38.0562427,-122.1507374,"1602 E 2nd St, Benicia","['1602, East 2nd Street, Benicia, Solano County, California, 94510, United States']",94510
543,McDonald's,38.10562,-122.209611,"2565 Springs Rd, Vallejo","[""McDonald's, 2565, Springs Road, Vallejo, Solano County, California, 94591, United States""]",94591
544,McDonald's,37.9964114,-122.5346171,"190 Merrydale Rd, San Rafael","[""McDonald's, 190, Merrydale Road, Cerro, San Rafael, Marin County, California, 94903, United States""]",94903
545,McDonald's,38.0818281,-122.1934389,"2110 Columbus Pkwy, Benicia","[""McDonald's, 2110, Columbus Parkway, Benicia, Solano County, California, 94510, United States""]",94510
546,McDonald's,38.0844029,-122.2318194,"170 Lincoln Rd E, Vallejo","['170, Lincoln Road East, Carquinez Heights, Vallejo, Solano County, California, 94591, United States']",94591
547,McDonald's,38.119161,-122.255518,"3289 Sonoma Blvd, Vallejo","[""McDonald's, 3289, Sonoma Boulevard, Vallejo, Solano County, California, 94590, United States""]",94590
548,McDonald's,38.0613919,-122.5321745,"5600 Nave Dr, Novato","['5600, Nave Drive, Novato, Marin County, California, 94949, United States']",94949
550,McDonald's,41.7553406,-124.1935026,"380 M St, Crescent City","['M Street, Crescent City, Del Norte County, California, 95531-4416, United States']",95531-4416
551,McDonald's,33.874303,-117.997819,"5900 Beach Blvd, Buena Park","['5900, Beach Boulevard, Buena Park, Orange County, California, 90621, United States']",90621
552,McDonald's,33.911396,-117.866642,"2505 E Imperial Hwy, Brea","['2505, East Imperial Highway, Brea, Orange County, California, 92821, United States']",92821
553,McDonald's,33.802771,-118.070621,"3562 Katella Ave, Los Alamitos","['Katella Avenue, Los Alamitos, Orange County, California, 90702, United States']",90702
554,McDonald's,33.8873373,-118.1423222,"16208 Lakewood Blvd, Bellflower","['16208, Lakewood Boulevard, Bellflower, Los Angeles County, California, 90706, United States']",90706
555,McDonald's,38.386147,-121.9330309,"817 Leisure Town Rd, Vacaville","['817, Leisure Town Road, Vacaville, Solano County, California, 95687, United States']",95687
556,McDonald's,38.3356434,-121.9535902,"3101 Alamo Dr, Vacaville","['3101, Alamo Drive, Vacaville, Solano County, California, 95687, United States']",95687
557,McDonald's,38.351834,-121.985321,"541 Davis St, Vacaville","['541, Davis Street, Vacaville, Solano County, California, 95687, United States']",95687
558,McDonald's,38.3612529,-121.972315,"1310 E Monte Vista Ave, Vacaville","[""McDonald's, 1310, East Monte Vista Avenue, Vacaville, Solano County, California, 95688, United States""]",95688
559,McDonald's,38.342156,-121.994608,"990 Alamo Dr, Vacaville","[""McDonald's, 990, Alamo Drive, Vacaville, Solano County, California, 95687, United States""]",95687
560,McDonald's,38.3931257,-121.4168651,"10051 Bruceville Rd, Elk Grove","['10051, Bruceville Road, Elk Grove, Sacramento County, California, 95757, United States']",95757
562,McDonald's,37.0085217,-121.5510939,"7150 Camino Arroyo, Gilroy","['Walmart Supercenter, 7150, Camino Arroyo, Pacheco Pass Center, Gilroy, Santa Clara County, California, 95020, United States']",95020
563,McDonald's,37.0138082,-121.5863532,"797 1st St, Gilroy","['797, 1st Street, Gilroy, Santa Clara County, California, 95020, United States']",95020
564,McDonald's,37.02363920000001,-121.5624516,"8390 Arroyo Cir, Gilroy","[""McDonald's, 8390, Arroyo Circle, Gilroy, Santa Clara County, California, 95020, United States""]",95020
565,McDonald's,36.4183255,-121.3213965,"1215 Front St, Soledad","['1215, Front Street, Soledad, Monterey County, California, 93960, United States']",93960
566,McDonald's,35.77631179999999,-119.2466354,"907 Cecil Ave, Delano","['907, Cecil Avenue, Delano, Kern County, California, 93215, United States']",93215
567,McDonald's,36.1970674,-119.3273646,"1310 E Bardsley Ave, Tulare","['1310, East Bardsley Avenue, Tulare, Tulare County, California, 93274, United States']",93274
568,McDonald's,33.9457098,-118.3085999,"1763 W Century Blvd, Los Angeles","['1763, West Century Boulevard, Gramercy Park, Los Angeles, Los Angeles County, California, 90047, United States']",90047
569,McDonald's,34.0886817,-118.3096721,"1007 N Western Ave, Los Angeles","['Western Avenue, East Hollywood, Los Angeles, Los Angeles County, California, 90029-3737, United States']",90029-3737
570,McDonald's,36.297718,-119.313115,"3636 S Mooney Blvd, Visalia","['South Mooney Boulevard, Visalia, Tulare County, California, 93291, United States']",93291
571,McDonald's,36.3252175,-119.2765743,"1401 E Noble Ave, Visalia","['1401, East Noble Avenue, Visalia, Tulare County, California, 93292, United States']",93292
572,McDonald's,36.837932,-119.698494,"1055 Herndon Ave, Clovis","['1055, Herndon Avenue, Clovis, Fresno County, California, 93612, United States']",93612
573,McDonald's,38.0054117,-121.7520902,"914 Main St, Oakley","['Main Street, Oakley, Contra Costa County, California, 94561, United States']",94561
574,McDonald's,38.0209875,-121.9423581,"220 Bailey Rd, Bay Point","['220, Bailey Road, Bay Point, Contra Costa County, California, 94565, United States']",94565
575,McDonald's,38.0036974,-121.8345025,"2424 Mahogany Way, Antioch","['2424, Mahogany Way, Antioch, Contra Costa County, California, 94509, United States']",94509
576,McDonald's,38.009338,-121.8685736,"2203 Loveridge Rd, Pittsburg","['Walmart, 2203, Loveridge Road, Pittsburg, Contra Costa County, California, 94565, United States']",94565
579,McDonald's,37.0543666,-120.8798654,"1575 W Pacheco Blvd, Los Banos","['Walmart Supercenter, 1575, West Pacheco Boulevard, Los Banos, Merced County, California, 93635, United States']",93635
580,McDonald's,37.0575337,-120.878893,"1500 W Pacheco Blvd, Los Banos","['West Pacheco Boulevard, Los Banos, Merced County, California, 93635, United States']",93635
581,McDonald's,37.3609842,-120.5954781,"2720 Shaffer Rd, Atwater","[""McDonald's, 2720, Shaffer Road, Atwater, Merced County, California, 95301, United States""]",95301
582,McDonald's,37.2593754,-120.999798,"430 1st Ave, Gustine","[""McDonald's, 430, 1st Avenue, Gustine, Merced County, California, 95322, United States""]",95322
583,McDonald's,37.3187045,-120.4734586,"206 W Olive Ave, Merced","[""McDonald's, 206, West Olive Avenue, Merced, Merced County, California, 95348, United States""]",95348
584,McDonald's,37.4040324,-120.849557,"7960 Lander Ave, Hilmar","['7960, Lander Avenue, Irwin, Hilmar, Merced County, California, 95324, United States']",95324
585,McDonald's,36.75023910000001,-120.3874912,"750 Derrick Ave, Mendota","['Derrick Avenue, Mendota, Fresno County, California, 93640, United States']",93640
586,McDonald's,36.974161,-120.083955,"2290 W Cleveland Ave, Madera","['2290, West Cleveland Avenue, Madera, Madera County, California, 93637, United States']",93637
587,McDonald's,36.6390573,-120.6262177,"46330 W Panoche Rd, Firebaugh","['Chevron, 46330, West Panoche Road, Fresno County, California, 93622, United States']",93622
588,McDonald's,36.735177,-120.061229,"15100 W Whitesbridge Ave, Kerman","['West Whitesbridge Avenue, Kerman, Fresno County, California, 93706, United States']",93706
589,McDonald's,41.39761499999999,-122.379612,"1925 Shastina Dr, Weed","[""McDonald's, 1925, Shastina Drive, Weed, Siskiyou County, California, 96094, United States""]",96094
590,McDonald's,34.1352977,-118.0511756,"400 S Baldwin Ave, Arcadia","['Baldwin Avenue, West Arcadia, Arcadia, Los Angeles County, California, 91007-7922, United States']",91007-7922
591,McDonald's,37.9887915,-121.7859533,"3450 Deer Valley Rd, Antioch","['Deer Valley Road, Antioch, Contra Costa County, California, 94531, United States']",94531
592,McDonald's,37.9629605,-121.7621448,"4893 Lone Tree Wy, Antioch","['Walmart Supercenter, 4893, Lone Tree Way, Antioch, Contra Costa County, California, 94531, United States']",94531
593,McDonald's,37.9665434,-121.7828257,"4440 Lone Tree Wy, Antioch","['Lone Tree Way, Antioch, Contra Costa County, California, 94531, United States']",94531
594,McDonald's,38.129925,-121.275818,"200 W Lodi Ave, Lodi","['West Lodi Avenue, Lodi, San Joaquin County, California, 95241, United States']",95241
595,McDonald's,41.7026576,-122.6448917,"1806 Fort Jones Rd, Yreka","['1806, Fort Jones Road, Yreka, Siskiyou County, California, 96097, United States']",96097
596,McDonald's,36.7363219,-119.6975416,"5645 E Kings Canyon Rd, Fresno","['5645, East Kings Canyon Road, Fresno, Fresno County, California, 93727, United States']",93727
597,McDonald's,36.6267897,-119.6829218,"327 W Merced St, Fowler","['327, West Merced Street, Fowler, Fresno County, California, 93625, United States']",93625
598,McDonald's,36.6036504,-119.4582238,"835 N Reed Ave, Reedley","['835, North Reed Avenue, Reedley, Fresno County, California, 93654, United States']",93654
599,McDonald's,36.35717169999999,-119.2966009,"3102 N Dinuba Blvd, Visalia","['North Dinuba Boulevard, Visalia, Tulare County, California, 93291, United States']",93291
600,McDonald's,36.3125974,-119.3487927,"5215 W Walnut Ave, Visalia","['5215, West Walnut Avenue, Visalia, Tulare County, California, 93277, United States']",93277
601,McDonald's,36.341392,-119.349072,"5205 W Goshen Ave, Visalia","['West Goshen Avenue, Visalia, Tulare County, California, 93227, United States']",93227
602,McDonald's,36.3279684,-119.3314006,"3636 W Mineral King Ave, Visalia","['3636, West Mineral King Avenue, Visalia, Tulare County, California, 93291, United States']",93291
603,McDonald's,36.5438555,-119.401785,"700 W El Monte Way, Dinuba","['West El Monte Way, Dinuba, Tulare County, California, 93618, United States']",93618
604,McDonald's,36.2132858,-119.3486191,"108 E Cross Ave, Tulare","['108, East Cross Avenue, Tulare, Tulare County, California, 93274, United States']",93274
605,McDonald's,36.3258506,-119.2100903,"430 Avenue 295, Farmersville","['Avenue 295, Farmersville, Tulare County, California, 93233, United States']",93233
606,McDonald's,36.576711,-119.626045,"2790 Floral Ave, Selma","['2790, Floral Avenue, Selma, Fresno County, California, 93662, United States']",93662
607,McDonald's,35.8922355,-119.2713694,"975 N Earlimart Ave, Earlimart","['975, North Earlimart Avenue, Earlimart, Tulare County, California, 93219, United States']",93219
608,McDonald's,36.1809347,-119.3299744,"2710 S Blackstone St, Tulare","['South Blackstone Street, Tulare, Tulare County, California, 93274, United States']",93274
609,McDonald's,36.705587,-119.577721,"2761 Jensen Ave, Sanger","['Walmart Supercenter, 2761, Jensen Avenue, Sanger, Fresno County, California, 93657, United States']",93657
610,McDonald's,37.9547368,-122.0420609,"1691 Monument Blvd, Concord","['1691, Monument Boulevard, Palm Terrace Appartments, Concord, Contra Costa County, California, 94520, United States']",94520
611,McDonald's,37.973176,-122.0645188,"624 Contra Costa Blvd, Pleasant Hill","['624, Contra Costa Boulevard, College Park Center, Pleasant Hill, Contra Costa County, California, 94523, United States']",94523
612,McDonald's,37.892388,-122.114001,"3459 Mt Diablo Blvd, Lafayette","['3459, Mount Diablo Boulevard, Lafayette, Contra Costa County, California, 94549, United States']",94549
613,McDonald's,36.5432528,-119.2863628,"41536 Rd 128, Orosi","['Road 128, Orosi, Tulare County, California, 93647, United States']",93647
614,McDonald's,34.4050941,-118.4647293,"26940 Sierra Hwy, Santa Clarita","['26940, Sierra Highway, Santa Clarita, Los Angeles County, California, 91321, United States']",91321
615,McDonald's,34.02599360000001,-118.4315177,"11300 National Blvd, Los Angeles","['11300, National Boulevard, Mar Vista, Los Angeles, Los Angeles County, California, 90064, United States']",90064
616,McDonald's,33.9812233,-118.4393401,"4680 Lincoln Blvd, Los Angeles","['4680, Lincoln Boulevard, Del Rey, Los Angeles, Los Angeles County, California, 90292, United States']",90292
617,McDonald's,34.2169058,-118.3881106,"8045 Lankershim Blvd, North Hollywood","['North Hollywood, Lankershim Boulevard, NoHo, North Hollywood, Los Angeles, Los Angeles County, California, 91601-3121, United States']",91601-3121
618,McDonald's,34.198872,-118.4491875,"7045 Van Nuys Blvd, Van Nuys","['7045, Van Nuys Boulevard, Van Nuys, Los Angeles, Los Angeles County, California, 91405, United States']",91405
619,McDonald's,34.1850843,-118.3871685,"6309 Lankershim Blvd, North Hollywood","['6309, Lankershim Boulevard, North Hollywood, Los Angeles, Los Angeles County, California, 91606, United States']",91606
620,McDonald's,36.9719166,-120.0451726,"1406 W Yosemite Ave, Madera","['West Yosemite Avenue, Madera, Madera County, California, 93637, United States']",93637
621,McDonald's,38.4813883,-121.4072459,"8140 Gerber Rd, Sacramento","[""McDonald's, 8140, Gerber Road, Elk Grove, Sacramento County, California, 95828, United States""]",95828
622,McDonald's,33.8028911,-117.8886277,"1810 S State College Blvd, Anaheim","['1810, South State College Boulevard, Anaheim Resort District, Anaheim, Orange County, California, 92806, United States']",92806
623,McDonald's,34.0313211,-117.9153558,"2501 S Azusa Ave, West Covina","['2501, South Azusa Avenue, Hacienda Heights, West Covina, El Monte, Los Angeles County, California, 91745, United States']",91745
625,McDonald's,39.3946034,-123.3495355,"1488 S Main St, Willits","['South Main Street, Willits, Mendocino County, California, 95490, United States']",95490
626,McDonald's,39.4239709,-123.8069104,"1190 S Main St, Fort Bragg","['1190, South Main Street, Noyo, Fort Bragg, Mendocino County, California, 95437, United States']",95437
628,McDonald's,37.92580030000001,-121.7363805,"2351 Balfour Rd, Brentwood","['2351, Balfour Road, Brentwood, Contra Costa County, California, 94513, United States']",94513
629,McDonald's,37.4344581,-121.9013599,"99 N Milpitas Blvd, Milpitas","['99, North Milpitas Boulevard, Milpitas, Santa Clara County, California, 95035, United States']",95035
630,McDonald's,37.4271376,-121.9217764,"41 Ranch Dr, Milpitas","[""McDonald's, 41, Ranch Drive, Milpitas, Santa Clara County, California, 95035-5119, United States""]",95035-5119
631,McDonald's,37.2438457,-121.9598446,"15475 Los Gatos Blvd, Los Gatos","['15475, Los Gatos Boulevard, Los Gatos, Santa Clara County, California, 95032, United States']",95032
632,McDonald's,37.29183630000001,-121.9968036,"18578 Prospect Rd, Saratoga","['McDonalds, 18578, Prospect Road, Saratoga, Santa Clara County, California, 95070, United States']",95070
633,McDonald's,34.424005,-119.288557,"11444 N Ventura Ave, Ojai","['North Ventura Avenue, Matilija, Ojai, Ventura County, California, 93023, United States']",93023
634,McDonald's,36.3267864,-121.249048,"501 El Camino Real, Greenfield","['501, El Camino Real, Greenfield, Monterey County, California, 93927, United States']",93927
635,McDonald's,36.2024773,-121.1361362,"1350 Broadway Cir, King City","['Broadway Circle, King City, Monterey County, California, 93930, United States']",93930
636,McDonald's,36.8589614,-121.4012842,"151 San Felipe Rd, Hollister","[""McDonald's, 151, San Felipe Road, Cottage Corners, Hollister, San Benito County, California, 95023-3029, United States""]",95023-3029
