,MDName,Latitude,Longitude,Address,Full Address,Zip Code
155,McDonald's,34.9561905,-120.4351088,"320 N Broadway, Santa Maria","['320, North Broadway, Santa Maria, Santa Barbara County, California, 93454, United States']",93454
156,McDonald's,35.12083700000001,-120.612524,"1550 W Grand Ave, Grover Beach","[""McDonald's, 1550, West Grand Avenue, Grover Beach, San Luis Obispo County, California, 93433, United States""]",93433
157,McDonald's,34.9202951,-120.4535657,"2280 Skyway Dr, Santa Maria","['2280, Skyway Drive, Santa Maria, Santa Barbara County, California, 93455, United States']",93455
158,McDonald's,35.40829009999999,-119.0214479,"225 N Chester Ave, Oildale","['North Chester Avenue, Seguro, Kern County, California, 93301, United States']",93301
159,McDonald's,35.3548395,-119.0615668,"5410 Stockdale Hwy, Bakersfield","['5410, Stockdale Highway, Kern City, Bakersfield, Kern County, California, 93309, United States']",93309
160,McDonald's,35.3172057,-119.0332329,"2701 White Ln, Bakersfield","['2701, White Lane, Bakersfield, Kern County, California, 93304, United States']",93304
161,McDonald's,35.4994804,-119.2787282,"101 W Lerdo Hwy, Shafter","['101, West Lerdo Highway, Shafter, Kern County, California, 93263, United States']",93263
162,McDonald's,35.3176005,-119.0898053,"7901 White Ln, Bakersfield","['7901, White Lane, Bakersfield, Kern County, California, 93309, United States']",93309
163,McDonald's,35.3535509,-119.0196636,"11 S Chester Ave, Bakersfield","['11, South Chester Avenue, Bakersfield, Kern County, California, 93304, United States']",93304
165,McDonald's,35.4118862,-119.0609166,"5363 Olive Dr, Bakersfield","['5363, Olive Drive, Bakersfield, Kern County, California, 93308, United States']",93308
166,McDonald's,35.3755583,-118.9503143,"3037 Niles St, Bakersfield","['Niles Street, Kern, Bakersfield, Kern County, California, 93305, United States']",93305
167,McDonald's,35.3491832,-119.1267295,"11150 Stockdale Hwy, Bakersfield","['11150, Stockdale Highway, Bakersfield, Kern County, California, 93311, United States']",93311
169,McDonald's,35.4020704,-119.0930428,"4601 Coffee Rd, Bakersfield","['4601, Coffee Road, Bakersfield, Kern County, California, 93308, United States']",93308
170,McDonald's,35.3806354,-119.0231064,"2310 F St, Bakersfield","['2310, F Street, Bakersfield, Kern County, California, 93301, United States']",93301
171,McDonald's,35.20945770000001,-118.8329619,"798 Bear Mountain Blvd, Arvin","['798, Bear Mountain Boulevard, Arvin, Kern County, California, 93203, United States']",93203
172,McDonald's,35.383113,-119.146609,"13003 Rosedale Hwy, Bakersfield","['Rosedale Highway, Bakersfield, Kern County, California, 93301, United States']",93301
173,McDonald's,35.3671305,-119.0429183,"1000 Real Rd, Bakersfield","['1000, Real Road, Bakersfield, Kern County, California, 93309, United States']",93309
174,McDonald's,35.3755788,-119.0024977,"1812 Union Ave, Bakersfield","['1812, Union Avenue, Bakersfield, Kern County, California, 93305, United States']",93305
175,McDonald's,35.339931,-119.0536297,"4600 Ming Ave, Bakersfield","['4600, Ming Avenue, Bakersfield, Kern County, California, 93309, United States']",93309
176,McDonald's,35.2957503,-119.0772452,"6707 Panama Ln, Bakersfield","['6707, Panama Lane, Bakersfield, Kern County, California, 93313, United States']",93313
177,McDonald's,35.391518,-118.960843,"2601 Fashion Plaza, Bakersfield","['2601, Fashion Plaza, Bakersfield, Kern County, California, 93306, United States']",93306
178,McDonald's,35.5908749,-120.6948392,"1859 Ramada Dr, Paso Robles","['1859, Ramada Drive, Templeton, Paso Robles, San Luis Obispo County, California, 93446, United States']",93446
179,McDonald's,35.6147235,-120.6817885,"186 Niblick Rd, Paso Robles","[""McDonald's, 186, Niblick Road, Paso Robles, San Luis Obispo County, California, 93446, United States""]",93446
180,McDonald's,35.642786,-120.6864672,"2715 Black Oak Dr, Paso Robles","[""McDonald's, 2715, Black Oak Drive, Paso Robles, San Luis Obispo County, California, 93447, United States""]",93447
181,McDonald's,37.3433385,-120.6151061,"1521 Bell Dr, Atwater","['1521, Bell Drive, Atwater, Merced County, California, 95301, United States']",95301
182,McDonald's,37.4646513,-121.1415127,"1001 Sperry Ave, Patterson","['1001, Sperry Avenue, Patterson, Stanislaus County, California, 95363, United States']",95363
184,McDonald's,37.3000331,-120.494381,"1060 W 13th St, Merced","['1060, West 13th Street, Merced, Merced County, California, 95341, United States']",95341
185,McDonald's,37.5151448,-120.8484855,"2400 Geer Rd, Turlock","['2400, Geer Road, Turlock, Stanislaus County, California, 95382, United States']",95382
186,McDonald's,37.60876409999999,-120.938393,"1500 Mitchell Rd, Ceres","['1500, Mitchell Road, Ceres, Stanislaus County, California, 95307, United States']",95307
187,McDonald's,37.1258721,-120.2550836,"250 E Robertson Blvd, Chowchilla","['250, Robertson Boulevard, Chowchilla, Madera County, California, 93610, United States']",93610
188,McDonald's,37.1003978,-121.0151795,"13032 CA-33, Santa Nella","['33, Santa Nella, Monterrey Estates, Rancho Santa Margarita, Orange County, California, 92688, United States']",92688
189,McDonald's,37.2888203,-120.4549102,"1821 Motel Dr, Merced","[""McDonald's, 1821, Motel Drive, Merced, Merced County, California, 95341, United States""]",95341
190,McDonald's,37.6089217,-120.9739324,"1324 E Hatch Rd, Modesto","['Modesto Union Academy, East Hatch Road, Ceres, Stanislaus County, California, 95358, United States']",95358
191,McDonald's,37.05652,-120.835017,"1480 Mercey Springs Rd, Los Banos","['Mercey Springs Road, Los Banos, Merced County, California, 93635, United States']",93635
192,McDonald's,37.4924734,-120.8721037,"2000 W Main St, Turlock","['2000, West Main Street, Turlock, Stanislaus County, California, 95380, United States']",95380
193,McDonald's,38.550518,-121.4884767,"2985 Freeport Blvd, Sacramento","['2985, Freeport Boulevard, Land Park, Sacramento, Sacramento County, California, 95818, United States']",95818
194,McDonald's,38.5715551,-121.4668065,"3006 K St, Sacramento","['3006, K Street, Sacramento, Sacramento County, California, 95816, United States']",95816
195,McDonald's,38.596642,-121.415841,"1721 Howe Ave, Sacramento","[""McDonald's, 1721, Howe Avenue, Sacramento County, California, 95825, United States""]",95825
196,McDonald's,38.4965263,-121.4306214,"6091 Florin Rd, Sacramento","['6091, Florin Road, Parkway-South Sacramento, Elk Grove, Sacramento County, California, 95823, United States']",95823
197,McDonald's,38.5911195,-121.5494,"800 Riverpoint Cir, West Sacramento","['Riverpoint Circle, Riverpoint Marketplace, West Sacramento, Yolo County, California, 95605, United States']",95605
198,McDonald's,38.555945,-121.409971,"7901 College Town Dr, Sacramento","['7901, College Town Drive, Brighton, Sacramento, Sacramento County, California, 95826, United States']",95826
199,McDonald's,38.58071899999999,-121.5311034,"1700 W Capitol Ave, West Sacramento","[""McDonald's, 1700, West Capitol Avenue, West Sacramento, Yolo County, California, 95691, United States""]",95691
200,McDonald's,38.455397,-121.404554,"8220 Calvine Rd, Sacramento","['8220, Calvine Road, Elk Grove, Sacramento County, California, 95828, United States']",95828
201,McDonald's,38.5967922,-121.5018634,"200 Richards Blvd, Sacramento","[""McDonald's, 200, Richards Boulevard, Sacramento, Sacramento County, California, 95811, United States""]",95811
202,McDonald's,38.5567865,-121.5400743,"2244 Lake Washington Blvd, West Sacramento","[""McDonald's, 2244, Lake Washington Boulevard, West Sacramento, Yolo County, California, 95691, United States""]",95691
203,McDonald's,38.5737152,-121.4095446,"2320 Fair Oaks Blvd, Sacramento","[""McDonald's, 2320, Fair Oaks Boulevard, Sacramento, Sacramento County, California, 95825, United States""]",95825
204,McDonald's,38.589637,-121.264855,"11250 White Rock Rd, Rancho Cordova","[""McDonald's, 11250, White Rock Road, Rancho Cordova, Sacramento County, California, 95742, United States""]",95742
205,McDonald's,38.5790204,-121.5482283,"2729 W Capitol Ave, West Sacramento","[""McDonald's, 2729, West Capitol Avenue, West Sacramento, Yolo County, California, 95691, United States""]",95691
207,McDonald's,33.7888913,-117.9611811,"9845 Chapman Ave, Garden Grove","[""McDonald's, 9845, Chapman Avenue, Garden Grove, Orange County, California, 92841, United States""]",92841
208,McDonald's,33.7882808,-117.8729381,"1839 W Chapman Ave, Orange","['1839, West Chapman Avenue, Orange, Orange County, California, 92868, United States']",92868
209,McDonald's,33.7890988,-118.3079488,"1712 Pacific Coast Hwy, Los Angeles","['1712, Pacific Coast Highway, Harbor City, Harbor Pines, Los Angeles, Los Angeles County, California, 90717, United States']",90717
210,McDonald's,33.734079,-117.850902,"1100 S Grand Ave, Santa Ana","['1100, Grand Avenue, Cedar Evergreen, Santa Ana, Orange County, California, 92705, United States']",92705
212,McDonald's,33.77445,-117.939448,"11171 Garden Grove Blvd, Garden Grove","['11171, Garden Grove Boulevard, Garden Grove, Orange County, California, 92843, United States']",92843
213,McDonald's,33.760221,-117.920786,"13971 Harbor Blvd, Garden Grove","['13971, Harbor Boulevard, Garden Grove, Orange County, California, 92840, United States']",92840
214,McDonald's,33.657405,-117.918706,"2300 Harbor Blvd, Costa Mesa","['The Home Depot, 2300, Harbor Boulevard, Costa Mesa, Orange County, California, 92626, United States']",92626
215,McDonald's,33.6850333,-117.9198821,"3141 Harbor Blvd, Costa Mesa","['3141, Harbor Boulevard, Costa Mesa, Orange County, California, 92626, United States']",92626
216,McDonald's,33.616249,-117.910663,"700 Pacific Coast Hwy, Newport Beach","['700, Pacific Coast Highway, Newport Heights, Newport Beach, Orange County, California, 92663, United States']",92663
217,McDonald's,33.730659,-117.798266,"2452 Bryan Ave, Tustin","['Bryan Avenue, Browning Station, Tustin, Orange County, California, 92780, United States']",92780
218,McDonald's,33.7823665,-118.1534153,"3302 E Anaheim St, Long Beach","['3302, East Anaheim Street, Long Beach, Los Angeles County, California, 90804, United States']",90804
219,McDonald's,33.7910204,-118.2609307,"230 E Pacific Coast Hwy, Wilmington","['Pacific Coast Highway, Wilmington, Los Angeles, Los Angeles County, California, 90744-4522, United States']",90744-4522
220,McDonald's,33.7172063,-117.9886933,"16866 Beach Blvd, Huntington Beach","[""McDonald's, 16866, Beach Boulevard, Ocean View, Huntington Beach, Orange County, California, 92647, United States""]",92647
221,McDonald's,33.730389,-118.014333,"6561 Edinger Ave, Huntington Beach","['6561, Edinger Avenue, Huntington Beach, Orange County, California, 92647, United States']",92647
222,McDonald's,33.746013,-117.821572,"245 E 1st St, Tustin","['245, East 1st Street, Browning, Tustin, Orange County, California, 92780, United States']",92780
223,McDonald's,36.323174,-119.673378,"110 12th Ave, Hanford","['12th Avenue, Hanford, Kings County, California, 93230-5903, United States']",93230-5903
224,McDonald's,36.2538924,-120.2494919,"25145 W Dorris Ave, Coalinga","[""McDonald's, 25145, West Dorris Avenue, Coalinga, Fresno County, California, 93210, United States""]",93210
225,McDonald's,35.6154746,-119.6606921,"14802 Powers St, Lost Hills","['Mobil Mart, 14802, Powers Street, Lost Hills, Kern County, California, 93249, United States']",93249
226,McDonald's,36.1368319,-120.3634154,"396 W Elm Ave, Coalinga","['396, West Elm Avenue, Coalinga, Fresno County, California, 93210, United States']",93210
229,McDonald's,36.3129142,-119.7813334,"1089 N Lemoore Ave, Lemoore","['1089, North Lemoore Avenue, Lemoore, Kings County, California, 93245, United States']",93245
230,McDonald's,36.34303510000001,-119.6565943,"810 W Grangeville Blvd, Hanford","['810, West Grangeville Boulevard, Hanford, Kings County, California, 93230, United States']",93230
231,McDonald's,36.3276479,-119.6504366,"335 W Lacey Blvd, Hanford","['335, West Lacey Boulevard, Hanford, Kings County, California, 93230, United States']",93230
232,McDonald's,36.0976747,-119.5724487,"2003 Whitley Ave, Corcoran","['2003, Whitley Avenue, Corcoran, Kings County, California, 93212, United States']",93212
233,McDonald's,35.7465036,-119.2469881,"610 Woollomes Ave, Delano","['610, Woollomes Avenue, Delano, Kern County, California, 93215, United States']",93215
234,McDonald's,35.4031896,-119.4005672,"20700 Tracy Ave, Buttonwillow","[""McDonald's, 20700, Tracy Avenue, Buttonwillow, Kern County, California, 93206, United States""]",93206
235,McDonald's,35.6740459,-119.2281081,"101 W Sherwood Ave, McFarland","['101, West Sherwood Avenue, McFarland, Kern County, California, 93250, United States']",93250
236,McDonald's,34.0721813,-117.3697885,"1615 S Riverside Ave, Rialto","['1615, South Riverside Avenue, Rialto, San Bernardino County, California, 92376, United States']",92376
237,McDonald's,33.975335,-117.35923,"2242 University Ave, Riverside","['2242, University Avenue, Riverside, Riverside County, California, 92507, United States']",92507
238,McDonald's,34.0633655,-117.2835351,"100 E Redlands Blvd, San Bernardino","['100, East Redlands Boulevard, Redlands, San Bernardino County, California, 92373, United States']",92373
239,McDonald's,33.915807,-117.327162,"221 E Alessandro Blvd, Riverside","['Alessandro Boulevard, Moreno Valley, Riverside County, California, 92553, United States']",92553
240,McDonald's,33.935412,-117.403168,"7474 Indiana Ave, Riverside","['7474, Indiana Avenue, Casa Blanca, Riverside, Riverside County, California, 92504, United States']",92504
241,McDonald's,33.939007,-117.279522,"2891 Canyon Springs Pkwy, Riverside","['2891, Canyon Springs Parkway, Riverside, Riverside County, California, 92507, United States']",92507
242,McDonald's,34.1024649,-117.2982945,"699 W 2nd St, San Bernardino","['699, West 2nd Street, San Bernardino, San Bernardino County, California, 92410, United States']",92410
243,McDonald's,33.917733,-117.236419,"24440 Alessandro Blvd, Moreno Valley","['24440, Alessandro Boulevard, Moreno Valley, Riverside County, California, 92553, United States']",92553
244,McDonald's,34.0478392,-117.3094153,"1201 S Mt Vernon Ave, Colton","['Mount Vernon Avenue, Colton, San Bernardino County, California, 92324, United States']",92324
245,McDonald's,33.8451617,-117.2248017,"64 Ramona Expy, Perris","['Ramona Expressway, Perris, Riverside County, California, 92551, United States']",92551
246,McDonald's,33.9905642,-117.3393112,"2246 Iowa Ave, Riverside","['2246, Iowa Avenue, Riverside, Riverside County, California, 92507, United States']",92507
247,McDonald's,34.0632646,-117.2094695,"1620 W Redlands Blvd, Redlands","['1620, West Redlands Boulevard, Redlands, San Bernardino County, California, 92373, United States']",92373
248,McDonald's,34.121058,-117.3708688,"111 W Baseline Rd, Rialto","['West Baseline Road, Rialto, San Bernardino County, California, 92376-4861, United States']",92376-4861
249,McDonald's,34.0477435,-117.241611,"25775 Barton Rd, Loma Linda","['25775, Barton Road, Loma Linda, San Bernardino County, California, 92354, United States']",92354
251,McDonald's,34.0549306,-117.1755999,"612 E Redlands Blvd, Redlands","[""McDonald's, 612, East Redlands Boulevard, Redlands, San Bernardino County, California, 92374, United States""]",92374
253,McDonald's,33.7264428,-117.0099357,"1231 S Sanderson Ave, Hemet","['Walmart Supercenter, 1231, South Sanderson Avenue, Egan, Hemet, Riverside County, California, 92545, United States']",92545
254,McDonald's,33.81335620000001,-116.486069,"5601 Ramon Rd, Palm Springs","['East Ramon Road, Cathedral City, Riverside County, California, 92276, United States']",92276
255,McDonald's,34.0334967,-117.3190068,"22257 Barton Rd, Grand Terrace","[""McDonald's, 22257, Barton Road, Grand Terrace, San Bernardino County, California, 92313, United States""]",92313
256,McDonald's,34.4698566,-117.366024,"13625 Bear Valley Rd, Victorville","['13625, Bear Valley Road, Victorville, San Bernardino County, California, 92392, United States']",92392
257,McDonald's,34.52641,-117.221721,"20221 CA-18, Apple Valley","['18, Apple Valley, Myford, Lower Peters Canyon, Irvine, Orange County, California, 92602, United States']",92602
258,McDonald's,33.946419,-117.421568,"5425 Arlington Ave, Riverside","['5425, Arlington Avenue, Riverside, Riverside County, California, 92504, United States']",92504
259,McDonald's,33.908458,-117.436282,"2905 Van Buren Boulevard, Riverside","['2905, Van Buren Boulevard, Arlington Station, Riverside, Riverside County, California, 92503, United States']",92503
260,McDonald's,33.9139208,-117.4588144,"10141 Magnolia Ave, Riverside","['10141, Magnolia Avenue, Riverside, Riverside County, California, 92503, United States']",92503
261,McDonald's,34.106131,-117.453966,"16063 Foothill Blvd, Fontana","['16063, Foothill Boulevard, Fontana, San Bernardino County, California, 92335, United States']",92335
262,McDonald's,33.9759064,-117.4769166,"8875 Limonite Ave, Riverside","['8875, Limonite Avenue, Pedley, Jurupa Valley, Riverside County, California, 92509, United States']",92509
263,McDonald's,34.1071298,-117.4897604,"14454 Foothill Blvd, Fontana","['14454, Foothill Boulevard, Fontana, San Bernardino County, California, 92335, United States']",92335
264,McDonald's,34.0697825,-117.139197,"1796 E Lugonia Ave, Redlands","['1796, East Lugonia Avenue, Redlands, San Bernardino County, California, 92374, United States']",92374
265,McDonald's,37.69203,-122.471282,"2450 Junipero Serra Blvd, Daly City","['2450, Junipero Serra Boulevard, Daly City, San Mateo County, California, 94015, United States']",94015
267,McDonald's,33.802144,-117.225594,"1675 N Perris Blvd, Perris","['NCHS Perris Health Center, 1675, North Perris Boulevard, Perris, Riverside County, California, 92571, United States']",92571
268,McDonald's,34.091806,-117.314131,"568 S Mt Vernon Ave, San Bernardino","['568, South Mount Vernon Avenue, Bunker Hill, San Bernardino, San Bernardino County, California, 92410, United States']",92410
269,McDonald's,33.930845,-116.818907,"48350 Seminole Dr, Cabazon","['Seminole Drive, Cabazon, Riverside County, California, 92230, United States']",92230
271,McDonald's,39.14667730000001,-121.6444169,"1254 Stabler Ln, Yuba City","['1254, Stabler Lane, Yuba City, Sutter County, California, 95993, United States']",95993
272,McDonald's,39.1386246,-121.590874,"316 E St, Marysville","[""McDonald's, 316, E Street, Marysville, Yuba County, California, 95901, United States""]",95901
273,McDonald's,39.1413426,-121.6292449,"866 Colusa Ave, Yuba City","['Colusa Avenue, Yuba City, Sutter County, California, 905, United States']",905
274,McDonald's,39.759287,-121.856615,"2452 Connors Ave, Chico","['Connors Avenue, Chico, Butte County, California, 95973, United States']",95973
275,McDonald's,39.716568,-121.795763,"2444 Notre Dame Blvd, Chico","['2444, Notre Dame Boulevard, Chico, Butte County, California, 95928, United States']",95928
277,McDonald's,39.3599066,-121.6883992,"1513 CA-99, Gridley","['CA 99, Gridley, Butte County, California, 95948, United States']",95948
279,McDonald's,39.7617134,-121.8211468,"1388 East Ave, Chico","['1388, East Avenue, Chico, Butte County, California, 95926, United States']",95926
280,McDonald's,39.7378843,-121.8353105,"655 Palmetto Ave, Chico","['655, Palmetto Avenue, Chico, Butte County, California, 95926, United States']",95926
281,McDonald's,39.5245279,-122.2177811,"1401 W Wood St, Willows","['West Wood Street, Willows, Glenn County, California, 95988, United States']",95988
282,McDonald's,37.3652853,-118.3949596,"562 N Main St, Bishop","[""McDonald's, 562, North Main Street, Bishop Trailer Park, Bishop, Inyo County, California, 93514, United States""]",93514
283,McDonald's,33.6086843,-114.6059141,"191 S Lovekin Blvd, Blythe","[""McDonald's, 191, South Lovekin Boulevard, Blythe, Riverside County, California, 92225, United States""]",92225
286,McDonald's,32.6727243,-115.4983512,"720 Imperial Ave, Calexico","['720, South Imperial Avenue, Calexico, Imperial County, California, 92231, United States']",92231
287,McDonald's,32.7957786,-115.5694791,"345 N Imperial Ave, El Centro","[""McDonald's, 345, North Imperial Avenue, El Centro, Imperial County, California, 92243, United States""]",92243
288,McDonald's,32.9789762,-115.5422936,"105 W Main St, Brawley","['105, West Main Street, Brawley, Imperial County, California, 92227, United States']",92227
290,McDonald's,32.854392,-115.5704326,"810 N Imperial Ave, Imperial","['810, North Imperial Avenue, El Centro, Imperial County, California, 92243, United States']",92243
294,McDonald's,34.0710356,-117.8795242,"3030 E Garvey Ave S, West Covina","['3030, East Garvey Avenue South, West Covina, Los Angeles County, California, 91791, United States']",91791
295,McDonald's,34.4018818,-119.7223487,"1906 Cliff Dr, Santa Barbara","['1906, Cliff Drive, The Mesa, Santa Barbara, Santa Barbara County, California, 93109, United States']",93109
296,McDonald's,34.4222683,-119.6802254,"29 N Milpas St, Santa Barbara","['29, North Milpas Street, East Side, Santa Barbara, Santa Barbara County, California, 93103, United States']",93103
297,McDonald's,34.423608,-119.705139,"1213 State St, Santa Barbara","['Cat Therapy, 1213, State Street, Waterfront, Santa Barbara, Santa Barbara County, California, 93101, United States']",93101
298,McDonald's,34.440871,-119.753054,"3940 State St, Santa Barbara","[""McDonald's, 3940, State Street, Santa Barbara, Santa Barbara County, California, 93105, United States""]",93105
299,McDonald's,34.4368598,-119.8301855,"146 S Fairview Ave, Goleta","['146, South Fairview Avenue, Goleta, Santa Barbara County, California, 93117, United States']",93117
300,McDonald's,34.6139954,-120.1891208,"337 McMurray Rd, Buellton","['337, McMurray Road, Buellton, Santa Barbara County, California, 93427, United States']",93427
301,McDonald's,34.4290263,-119.8701266,"6900 Market Pl Dr, Goleta","['Market Place Drive, Goleta, Santa Barbara County, California, 93117-3021, United States']",93117-3021
302,McDonald's,34.6515643,-120.458235,"835 N H St, Lompoc","['835, North H Street, Lompoc, Santa Barbara County, California, 93436, United States']",93436
303,McDonald's,34.864475,-118.176343,"2511 W Rosamond Blvd, Rosamond","['2511, West Rosamond Boulevard, Rosamond, Kern County, California, 93560, United States']",93560
304,McDonald's,34.6969613,-118.1723904,"2301 W Lancaster Blvd, Lancaster","['Chevron, 2301, West Lancaster Boulevard, Lancaster, Los Angeles County, California, 93536, United States']",93536
305,McDonald's,34.6763291,-118.1127745,"43645 Challenger Way, Lancaster","['43645, Challenger Way, Lancaster, Los Angeles County, California, 93535, United States']",93535
306,McDonald's,35.0481866,-118.171875,"2351 CA-58, Mojave","['2351, Mojave-Barstow Highway, Mojave, Kern County, California, 93501, United States']",93501
307,McDonald's,34.7043203,-118.1467582,"839 W Ave I, Lancaster","['839, West Avenue I, Lancaster, Los Angeles County, California, 93534, United States']",93534
308,McDonald's,35.1245935,-118.4696122,"795 Tucker Rd, Tehachapi","['795, Tucker Road, Tehachapi, Kern County, California, 93561, United States']",93561
309,McDonald's,35.1260692,-118.4083352,"2000 E Tehachapi Blvd, Tehachapi","[""Loves' # 392 - Tehachapi, 2000, East Tehachapi Boulevard, Tehachapi, Kern County, California, 93561, United States""]",93561
310,McDonald's,34.68930930000001,-118.095186,"1860 E Ave. J, Lancaster","['1860, East Avenue J, Lancaster, Los Angeles County, California, 93535, United States']",93535
311,McDonald's,35.1256507,-117.9582741,"9628 California City Blvd, California City","['9628, California City Boulevard, California City, Kern County, California, 93505, United States']",93505
312,McDonald's,34.6744962,-118.1526207,"1200 W Ave K, Lancaster","[""McDonald's, 1200, West Avenue K, Lancaster, Los Angeles County, California, 93534, United States""]",93534
313,McDonald's,34.1068413,-117.5359326,"8070 Monet Ave, Rancho Cucamonga","['8070, Monet Avenue, Rancho Cucamonga, San Bernardino County, California, 91739, United States']",91739
314,McDonald's,33.8888067,-117.5204683,"400 N McKinley St, Corona","['North McKinley Street, Corona, Riverside County, California, 92515, United States']",92515
315,McDonald's,34.1069157,-117.5593496,"11198 Foothill Blvd, Rancho Cucamonga","['11198, Foothill Boulevard, Rancho Cucamonga, San Bernardino County, California, 91730, United States']",91730
316,McDonald's,38.132096,-122.22367,"902 Admiral Callaghan Ln, Vallejo","[""McDonald's, 902, Admiral Callaghan Lane, Hunter Ranch, Vallejo, Solano County, California, 94590, United States""]",94590
317,McDonald's,38.1544686,-122.2532985,"5200 Sonoma Blvd, Vallejo","[""McDonald's, 5200, Sonoma Boulevard, Vallejo, Solano County, California, 94589, United States""]",94589
318,McDonald's,38.319935,-122.298506,"3224 Jefferson St, Napa","['Jefferson Street, Salvador, Napa, Napa County, California, 94558, United States']",94558
320,McDonald's,38.2934494,-122.030772,"3500 Nelson Rd, Fairfield","[""McDonald's, 3500, Nelson Road, Fairfield, Solano County, California, 94533, United States""]",94533
321,McDonald's,38.480345,-122.735997,"879 Hopper Ave, Santa Rosa","['Chevron Santa Rosa, 879, Hopper Avenue, Coffey Park, Santa Rosa, Sonoma County, California, 95403, United States']",95403
322,McDonald's,38.2221335,-122.1262564,"4400 Central Pl, Fairfield","['4400, Central Place, Fairfield, Solano County, California, 94534, United States']",94534
323,McDonald's,38.281065,-122.275561,"806 W Imola Ave, Napa","['806, West Imola Avenue, Napa, Napa County, California, 94559, United States']",94559
324,McDonald's,38.303093,-122.477002,"18988 Sonoma Hwy, Sonoma","[""McDonald's, 18988, Sonoma Highway, Verano, Sonoma County, California, 95476, United States""]",95476
